Model Year,Labor Hours, Labor hours adjusted to .4 per sensor , Material Cost adjusted to 64.47 per sensor , Part MarkUp Adjusted to 18.42 per sensor , Misc. Amt (total) , Custom Column , Customer Paid Amount , Repair Dealer Paid Amount , Total Cost Gross ,Claim Key,VIN,Repair Dealer Code,Document Number,Part Num Full OB (Causal),Part Num Prefix (Causal),Part Num Base (Causal),Part Num Suffix (Causal),Vehicle Line AWS,Mileage,Load Date,Repair Date,Repair Dealer State,Country Repaired,Region Repaired,Production Date,Warranty Start Date,Country Sold,Customer Concern Code,Customer Comments,Condition Code,Technician Comments,Part Install Date,Transaction Code,Part Quantity, Original Labor Cost , Original Material Cost , Original Part MarkUp Adjusted to 18.42 per sensor ,SUPPLIER DISPUTES VALIDITY?,Supplier A DISPUTE REASON,,"Time In Service
(in years)",,,,,,,,,,,,,,,,,,
2020,0.6, $70.94 , $128.94 , $36.84 ,0,0,0,0, $199.88 ,10864091,1FA6P8SJ1L5505021,1325,734836D,KR3Z-1007-L,KR3Z,1007,L,ZA,11993,20-Mar-23,23-Nov-22,NJ,USA,NA,16-Oct-20,28-Dec-20,USA,B65,CHECK TO FRONT RIMS WHEN FILL WITH AIR THE RIMS LEAK,D4,"PRIOR APPRIVAL CONTACT IN NUMBER 11 9869794*********TECH 3032267******* *******VERIFIED THAT BOTH FRONT WHEELS ARE LEAKING FROM THE INSIDE OF THE WHEEL XX VEHICLE IS EQUIP WITH CARBON FIBER WHEELS AND ARE BOTH LEAKING XX NO SIGNS OF IMPACT DAMAGE OR ABUSE XX CONTACTED PRIOR APPROVAL AND PROVIDED THEM WITH PICTURES, THEY RESPONDED BACK WITH NO APPROVAL NECESSARY XX 3049991: REPLACED BOTH FRONT WHEELS DUE TO RESIN IN BARREL OF WHEEL BREAKING DOWN FROM HEAT. AND FRONT VALVE STEMS/SENSORS. INSTALLED WHEELS ON VEHICLE AND TORQUED TO SPEC. VERIFIED FRONT WHEELS NO LONGER LEAKING. VERIFIED REPAIR.",01-JAN-0001,E84,2, $100.72 ," $17,164.33 "," $8,116.19 ",X,Dealer states problem with carbon fiber rims leaking.  Rim leaks originating at the TPMS valve stem is generally caused by improper installation at the assembly plant and/or rim valve hole quality issues.  Non-Supplier A related claim.,,1.904109589,,,,,,,,,,,,,,,,,,
2021,14.2, $35.47 , $64.47 , $18.42 ,0,0,0,0, $99.94 ,7806829,1FD8X3G64MEC43261,5875,21654701,PC3Z-1109-A,PC3Z,1109,A,F7,50704,13-Apr-23,10-Mar-23,AR,USA,NA,02-Dec-20,27-Aug-21,USA,K15,"LITE: REPAIR/LITE DUTY GUEST STATES WHILE DRIVING ALONG, VEHICLE QUIT PULLING IN GEAR, FOUND HAD R/R AXLE LOOSE AND HAD CAUGHT ON FIRE UNDERNEATH, HAD TO TOW IN",42,"verified concern, inspected right rear axle, removed rear wheels and tires, found axle bearing had failed and seized and found axle housing was damaged, was caught on fire, tires were blown, wheels scorched, brake caliper and bracket, and parking brake shoe and backing plate, disassembled, raised rear of vehicle and supported, removed left rear wheels, tires and brakes, removed driveshaft, prepared to remove axle housing from vehicle, add on air helper springs needed to be removed and mounting hardware, removed axle, had to cut axle tube to remove right axle to remove carrier, removed and transferred internal case races and pinion bearings to new housing, installed and assembled axle housing, reinstalled components and replaced components damaged as listed earlier, new brake caliper and bracket, brake pads and parking brake shoe on right rear, installed new wheels, tires and tire sensors, filled fluid and bled brakes, MTADDON for customer added equipment MTAXLE for removing entire axle",01-JAN-0001,E95,1," $1,914.16 "," $7,649.79 "," $3,648.85 ",X,Dealer clearly states issues on vehicle caused by bearing failure and axle fire…NOT a TPM sensor problem.  This should never been filed as a TPMS warranty claim.,,1.534246575,,,,,,,,,,,,,,,,,,
2022,18.6, $35.47 , $64.47 , $18.42 ,0,0,0,0, $99.94 ,2992750,1FDWE3FN6NDC42917,8075,540187A,LC24-4001-ND,LC24,4001,ND,E1,746,06-Apr-23,05-Dec-22,NC,USA,NA,26-Jan-22,02-Feb-22,USA,K02,"CUSTOMER STATES ABS LIGHTON AND SMOKE FROM DRIVERS SIDE REAR TIRES *WARRANTY ADMIN NOTE 4/4- I added a note in the tech comments section when attaching original documents- since our dealership buy/sell, the accounting copies do not display time punches, so I included the last page of the warranty copy that does display time punches. I have now also attached all of the warranty copies for review- the time punches are shown on the last page.",42,"INSPECTED AND FOUND OIL AROUND THE LEFT REAR WHEELS. REMOVED WHEELS AND FOUND THE HUB SEAL LEAKING. REMOVED LEFT REAR AXLE AND FOUND LOOSE HUB NUT. THE HUB NUT HAD COME LOOSE AND THE HUB AND HOUSING WERE DAMAGED. THE HUB COULD NOT BE REMOVED FROM THE HOUSING BECAUSE OF THE DAMAGED NUT, BEARINGS AND HUB. REMOVED DIFFERENTIAL CASE AND FOUND METAL THROUGH THE HOUSING. FOUND DAMAGE TO ALL BEARINGS, RING AND PINION GEARS. DUE TO THE EXTENT OF THE DAMAGE THE ENTIRE DIFFERENTIAL HOUSING ASSEMBLY HAD TO BE REPLACED. REPLACED DIFFERENTIAL HOUSING ASSEMBLY. REPLACED BROKEN LEFT INNER VALVE STEM. REPLACED ALL NEEDED HARDWARE. THE VEHICLE WAS EQUIPPED WITH AFTERMARKET OVERSIZED LEAVE SPRINGS AND LONGER AFTERMARKET U-BOLTS AND NUTS. REUSED AFTERMARKET U-BOLTS AND NUTS WITH LOCTITE. OTHER ONE TIME USE HARDWARE WAS UNAVAILABLE. REUSED SOME ONETIME USE HARDWARE WITH LOCTITE AND OBTAINED OTHER HARDWARE FROM NAPA. REPLACED LEFT READ WHEEL SPEED SENSOR BECAUSE IT WAS MELTED DUE TO OVERHEATING. THE REAR DIFFERENTIAL HOUSING WAS NOT EASILY REMOVED FROM THE MOTORHOME DUE TO CLEARANCE ISSUES. HAD TO REMOVE AND INSTALL FUEL TANK, 2.0 MTIME NEEDED TO REMOVE MUFFLER AND TAIL PIPE SECTION FOR ACCESS. 2.5 MTIME NEEDED TO REMOVE AND INSTALL AFTERMARKET MUDFLAPS AND BRAKETS FOR ACCESS. 7.6 MTIME NEEDED TO SUSPEND MOTORHOME FROM THE BACK OF A 4 POST LIFT AND JACKSTANDS, REMOVE ENTIRE REAR DIFFERENTIAL HOUSING WITH FORKLIFT, TO REALIGN THE NEW DIFFERENTIAL AND TO SET PROPER PINION TO DRIVESHAFT ANGLE TO PREVENT VIBRATION BY INSTALLING REAR DIFFERENTIAL WEDGES BETWEEN THE DIFFERENTIAL AND LEAF SPRINGS. NOTE -WARRANTY HISTORY SHOWS THAT VEHICLE WAS INSPECTED FOR CONCERN AT LAFAYETTE FORD, BUT NO WORK WAS PERFORMED DUE TO SIZE OF V EHICLE. *WARRANTY ADMIN NOTE - Included the last page of the warranty copy in attached documents to show the technician clock punch times; they are not displayed on the accounting copy.",01-JAN-0001,1,1," $2,439.77 "," $5,767.07 "," $2,777.40 ",X,Dealer clearly states issue was caused by vehicle HUB SEAL faulty and leaking…NOT a TPM sensor problem.  This should never been filed as a TPMS warranty claim.,,0.838356164,,,,,,,,,,,,,,,,,,
2021,14.6, $35.47 , $64.47 , $18.42 ,483.5631589,0,0,0, $99.94 ,7639527,1FDWE3FN6MDC34542,B6293,793991A,BC3Z-1240-A,BC3Z,1240,A,E1,37506,29-Mar-23,05-Aug-22,AB,CAN,NA,20-Nov-20,24-Feb-21,USA,K15,"TOW IN- CHECK AND ADVISE FOR LEFT REAR TIRES ARE LOOSE, VEHICLE IS NOT DRIVABLE continuation of tech comments: REPLACE BEARINGS & SEAL ON RH HUB & RE-INSTALL IN VEHICLE. INSTALL NEW HUB, ROTOR, BEARINGS, SEAL, CALIPER BRACKET & WHEEL ON LH SIDE REPLACING HARDWARE. FILL NEW DIFFERENTIAL HOUSING. TORQUE ALL WHEELS. RE-INSTALL DRIVESHAFT & INSTALL NEW BOLTS. CLEAR ABS & TRACTION DTC`S. TEST DROVE & VERIFIED NO AXLE NOISE PRESENT. ANY PARTS NOT ABLE TO BE RETURNED IN ORIGINAL BOXES IS BECAUSE THEY ARE STUCK IN HOUSING ASSEMBLY & CANNOT BE REMOVED WITHOUT CUTTING HOUSING INTO PIECES CITY WIDE TOWING INVOICE 156911-1 (TOW VEHICLE INTO SHOP DUE TO VEHICLE MOT BEING MOBILE)",42,"656237 4205A 1.8, 4205A13G 5.6, 1007AE 0.6 ATTEMPT MULTIPLE SET UPS OF DIFFERENTIAL DUE TO MISSING SHIMS & REPLACING IRREGULAR BENT/DAMAGED COMPONENTS 6.8MT VEHICLE IS IN MILES, USA SOLD & REGISTERED IN CALIFORNIA. JACKED UP REAR OF VEH & ATTEMPT TO SPIN WHEEL, DOES NOT TURN & IS AT INCORRECT ANGLE. C0037 C1A95 PRESENT FOR ABS. REMOVE AXLE BOLTS & FOUND LR AXLE IS BROKEN AT HUB RETAINING NUT & SHAFT IS JAMMED INTO HOUSING. WAITING FOR MAINTENANCE RECORDS. OBTAIN MAINTENANCE RECORDS & ENSURED WARRANTY COVERAGE. HAD VEHICLE TOWED INTO SHOP. REMOVE LH WHEELS & FOUND INNER WHEEL DAMAGED & TPMS SENSOR DAMAGED DUE TO TIRE BLOW OUT. BLOWOUT WAS CAUSED BY RUBBING ON LEAF SPRING FROM ANGLE CAUSED BY DAMAGED AXLE HOUSING. MOUNT NEW TIRE ON NEW RIM & REPLACE SENSOR. REPLACE WHEEL & SENSOR. REMOVE HUB ASSEMBLY & FOUND AXLE IS NOW WARPED AT AN APPROXIMATELY 45 DEGREE ANGLE DUE TO HEAT & BEARING FAILURE. REMOVE RH WHEELS. REMOVE CALIPERS & BRACKETS. FOUND LR CALIPER BRACKET, BACKING PLATE & PARK BRAKE SHOES DAMAGED, REPLACE ALL. REMOVE AXLE HOUSING FROM VEHICLE. CANNOT REMOVE CARRIER OR CROWN & PINION DUE TO AXLE SHAFT BEING WARPED INTO HOUSING. REPLACE LR AXLE SHAFT, AXLE HOUSING, CARRIER, & CROWN & PINION. TRIED TO FOLLOW WORKSHOP MANUAL FOR DIFFERENTIAL SET UP. COULD NOT FOLLOW WORKSHOP DUE TO MOST STEPS REQUIRING ""USE ORIGINAL SHIMS FOR SETUP""  OLD SHIMS ARE JAMMED IN HOUSING. ORDER RANDOM SIZE SHIMS TO ATTEMPT SETUP. BORROWED SPECIAL TOOLS FROM ANOTHER DEALER TO SET UP PINION DEPTH USING SHIMS PROVIDED WITH NEW PINION. USE RANDOM SIZED SHIMS TO ATTEMPT SET UP OF CARRIER ASSEMBLY ALONG WITH FEELER GAUGES. WAS ABLE TO OBTAIN APPROXIMATE SIZE OF NECESSARY SHIMS & ORDERED. NEW SHIMS ARE CLOSE BUT NOT ENOUGH BACKLASH. ORDER 1 MORE CARRIER OUTBOARD SHIM & WAS ABLE TO SET CORRECT BACKLASH AT 0.05"". WAS ABLE TO RE-USE COVER FROM ORIGINAL HOSING. CLEAN  RE-SEALED & INSTALL COVER. INSTALL NEW AXLE HOUSING IN VEHICLE REPLACING ALL ONE TIME USE HARDWARE. REPLACE BEARINGS & SEAL ON RH HU",01-JAN-0001,E95,1," $1,790.46 "," $5,236.40 "," $1,494.54 ",X,Dealer clearly states issue was caused by various structural underbody problems with this vehicle…NOT a TPM sensor problem.  This should never been filed as a TPMS warranty claim.,,1.443835616,,,,,,,,,,,,,,,,,,
2022,1.2, $141.88 , $257.88 , $73.68 ,0,0,0,0, $399.76 ,3132747,1FDRF3A69NEF86987,7851,34948401,*-OWNERGD-*,*,OWNERGD,*,F7,123,21-Apr-23,26-Jan-23,CA,USA,NA,06-Oct-22,07-Dec-22,USA,B65,MISBUILT UNIT . TRUCK WAS SOLD WITH TIRES SIZE 245/75/ R17 (WRONG SIZE) CORRECT SIZE - 275/65 R 18. NEEDS CORRECTION,38,- TECH REPLACED 4 TIRES AND WHEELS AFTER GETTING AUTHORIZATION FROM FORD MOTOR COMPANY TIRES : GENERAL GRABER 275/65R/18 DOT: A3B9-HMJ9-0323 X1 DOT:A3B9-HMJ9-4522 X3 CAS- 41240847-X0M9W0,01-JAN-0001,MVC,4, $300.00 ," $4,923.44 "," $2,300.40 ",X,"NO CUSTOMER ISSUE PRIOR TO REPLACEMENT OF WRONG SIZE WHEELS/TIRES FROM FORD.  MOST LIKELY DEALER DID NOT FOLLOW TPMS RELEARN PROCEDURE PROPERLY, OR DID NOT DRIVE VEHICLE LONG ENOUGH TO COMPLETE RELEARN.  DEALER NARRATIVE SHOWS NO VALID TPMS COMPLAINT OR REASON FOR REPLACING FOUR SENSORS UNDER WARRRANTY.",,0.136986301,,,,,,,,,,,,,,,,,,
2020,2.7, $35.47 , $64.47 , $18.42 ,0,0,0,0, $99.94 ,10914377,1FD8X3H69LEC25240,5574,84891801,LC3Z-5F250-A,LC3Z,5F250,A,F7,18409,24-Mar-23,10-Mar-23,CA,USA,NA,06-Dec-19,24-Feb-20,USA,E32,C/S THAT THE CHECK ENGINE LIGHT IS ON (SOP),D4,"5F250 D4 CUSTOMER STATES CHECK ENGINE LIGHT IS ON UPON INSPECTION ABLE TO DUPLICATE CONCERN PERFORMED DTC CHECK FOUND P0420 BANK 1 CATALYST BELOW THRESHOLD, PERFORMED OASIS CHECK PASS, PERFORMED PPT HF1 YES P0420, HF2 NO, HF4 YES 60PSI, HF6 NO EXHAUST LEAK, HF11 YES P0420 INTERNAL CAT FAILURE, REMOVED AND REPLACED BOTH BANK CATS SERVICED AS A WHOLE UNIT, REASSEMBLED REMOVED PARTS, CLEARED DTCS AND POST ROAD TEST PASS.",01-JAN-0001,S07,1, $467.10 ," $4,477.01 "," $2,158.52 ",X,**NEITHER THE CUSTOMER COMPLAINT NOR THE DEALER NARRATIVE STATES ANY TPMS CONCERNS.  THERE IS NO TPMS COMPLAINT SHOWN AND THIS SHOULD NOT HAVE BEEN FILED AS A TPMS CLAIM AGAINST Supplier A.,,3.04109589,,,,,,,,,,,,,,,,,,
2019,1.2, $141.88 , $257.88 , $73.68 ,0,0,0,0, $399.76 ,14098100,1FT7W2BT3KEG74956,8766,029615A,*-1007-*,*,1007,*,F7,21689,17-Mar-23,13-Mar-23,WI,USA,NA,07-Oct-19,28-Apr-20,USA,B65,Customer states rims are peeling,5,verified all 4 wheels are peeling checked for ouside damage none found and compared to job aid and found warrantable replaced wheels and sen; sors balanced and test drove sensors were replaced due to needing new valve stems for wheels and the valve stems are not available separately per parts catalog for this application. dealer can picture of parts screen if necessary,01-JAN-0001,E84,4, $126.23 ," $3,159.35 ", $902.67 ,X,Dealer clearly states: "REPLACE ALL 4 WHEELS AND TPMS SENSORS DUE TO RIMS PEELING".  This is not a TPMS issue and should not have been filed as a warranty claim.,,2.873972603,,,,,,,,,,,,,,,,,,
2020,0.9, $70.94 , $128.94 , $36.84 ,0,0,0,0, $199.88 ,11089271,1FT8W3DT4LEC26881,4962,425758C,JC3Z-1007-E,JC3Z,1007,E,F7,35414,17-Apr-23,05-Apr-23,FL,USA,NA,16-Jan-20,29-May-20,USA,B65,C/S: CUSTOMER STATES THE REAR OUTER TIRES KEEP LOSING AIR,5,"VERIFY BOTH TIRES LOW, PUT BOTH OUTSIDE WHEELS IN A WATER TANK TO CHECK FOR LEAKS. FOUND WHEELS LEAKING AROUND VALVE STEMS BECAUSE OF CORROSION ON THE WHEELS. INSPECTED AND BOTH WHEELS ARE DELAMINATING , REPLACED BOTH OUTER WHEELS. WHEN REMOVING SENSORS OFF VALVE STEMS BOTH SENSORS BROKE BEFORE SENSOR CAME OFF. REPLACED SENSORS AND VALVE STEMS. TRAINED TPMS SENSORS. VERIFY REPAIRS, 1007, 42",01-JAN-0001,E84,2, $149.40 ," $3,117.19 "," $1,528.41 ",X,DEALER CLEARLY STATES AIR LEAKS WERE CAUSED BY WHEEL DELAMINATION…NOT a TPM sensor problem.  This should never been filed as a TPMS warranty claim.,,2.852054795,,,,,,,,,,,,,,,,,,
2020,1.2, $35.47 , $64.47 , $18.42 ,0,0,0,0, $99.94 ,11048905,1FT8W3DT5LEE42268,572,396884G,JC3Z-1007-E,JC3Z,1007,E,F7,27142,11-Apr-23,21-Mar-23,NY,USA,NA,03-Sep-20,07-Oct-20,USA,B65,REAR RIMS ARE PEELING,1Q,"REMOVED BOTH OUTER REAR WHEELS AND BROKE DOWN TIRES, REMOVED TPMS SEMSORS AND INSTALLED ON NEW VALVE STEMS IN NEW WHEELS AND MOUNTED BALANCED TIRES, SET TIRE PRESSURES AND ATTEMPTED TO RELEARN TPMS SENSORS BUT LEFT OUTER REAR WOULD NOT RELEARN, ATTEMPTED DRIVING VEHICLE AND RELEARNING TIRES AGAIN, SENSOR WOULD NOT RELEARN, REMOVED LEFT OUTER WHEEL AND INSTALLED NEW TPMS SENSOR, ATTEMPTED TO RELEARN SENSORS AGAIN AND STILL LEFT OUTER REAR WOULD NOT RELEARN, TEST DROVE AGAIN AND RELEARNED ALL SENSORS AFTER NUMEROUS ATTEMPTS. ****************************************************",01-JAN-0001,E84,1, $140.21 ," $2,838.73 "," $1,295.94 ",X,DEALER CLEARLY STATES AIR LEAKS WERE CAUSED BY WHEEL DELAMINATION…NOT a TPM sensor problem.  This should never been filed as a TPMS warranty claim.,,2.452054795,,,,,,,,,,,,,,,,,,
2019,1.2, $141.88 , $257.88 , $73.68 ,338.9185367,0,0,0, $399.76 ,14115608,1FT7W2BT1KEG18546,B8214,20271103,HC3Z-1007-G,HC3Z,1007,G,F7,30569,21-Mar-23,06-Jan-23,ON,CAN,NA,26-Aug-19,08-May-20,CAN,B65,CUSTOMER REPORTS THAT THE CHROME ON HIS WHEELS IS PEELING,D4,REPLACE ALL 4 WHEELS AND TPMS SENSORS DUE TO RIMS PEELING,01-JAN-0001,E84,4, $101.40 ," $2,505.68 ", $654.86 ,X,Dealer clearly states: "REPLACE ALL 4 WHEELS AND TPMS SENSORS DUE TO RIMS PEELING".  This is not a TPMS issue and should not have been filed as a warranty claim.,,2.665753425,,,,,,,,,,,,,,,,,,
2019,50, $35.47 , $64.47 , $18.42 ,0,0,0,0, $99.94 ,14210663,1FTER4FHXKLA10522,8185,309575B,JR3Z-12A650-JANP,JR3Z,12A650,JANP,R2,23484,07-Apr-23,28-Jul-22,ID,USA,NA,21-Feb-19,01-Jul-19,USA,E29,C/S: CUSTOMER HAD A VEHICLE TOWED IN AS IT WILLNOT START. ALL LIGHTS TURN ON AND ALMOST EVERYWARNING LIGHT TURNS ON ON THE CLUSTER BUT WILLNOT FIRE UP THE ENGINE.,42,"VERIFIED CUSTOMER CONCERN, FOUND VEHICLE TO BE A NO CRANK NO START. MULTIPLE WARNING MESSAGES WERE FOUND TO BE COMING UP ON THE DISPLAY. PERFORMED PRIMARY CHECKS ON THE VEHICLE. CHECKED BATTERY VOLTAGE AND STATE OF CHARGE. PERFORMED QUICK ELECTRICAL TESTS ON THE STARTER SYSTEM AND WIRING. NO PROBLEMS WERE FOUND. USING FDRS PULLED CODES ON THE VEHICLE. FOUND FOR LOST COMMUNICATION WITH THE PCM. THE PCM WAS FOUND TO NOT BE RESPONDING WHEN PERFORMED A NETWORK TEST. FOLLOWED PINPOINT TEST A SECTION 418-00 A1 YES, A2 YES, A3 NO 0.00, A4 YES .4 OHMS, A5 YES. PERFORMED THIS PINPOINT TEST MULTIPLE TIMES TO VERIFY THE RESULTS. REPLACE THE PCM RVC CODE GENERATED RKCL9L87VBBY4. REPLACED THE PCM BY REMOVING THE BATTERY. REMOVED THE BATTERY JUNCTION BOX. REMOVED THE BRACKETS ALLOWING ACCESS FOR THE PCM REPLACEMENT. INSTALLED NEW PCM AND ATTEMPTED TO PROGRAM TO THE VEHICLE. THE PCM WAS UNABLE TO BE PROGRAMMED TO THE VEHICLE DUE TO IT STILL NOT COMMUNICATING TO THE HIGH SPEED NETWORK. CONTACTED HOTLINE ON WHERE TO GO WITH THE VEHICLE. AS SUGGESTED BY HOTLINE USED ANOTHER FDRS WITH UP TO DATE SOFTWARE TO NO AVAIL. AS DIRECTED USED THE GRX-3590 TO PERFORM A BATTERY TEST AND PASSED. INSPECTED FOR AFTERMARKET COMPONENTS AND VEHICLE WAS FOUND TO HAVE TRAILER BRAKE CONTROLLER. REMOVED THE CONTROLLER. CHECKED TO MAKE SURE THE NETWORK WAS NOT SHORTED TOGETHER OR TO A GROUND. AS DIRECTED AFTER FURTHER COMMUNICATION PERFORMED PINPOINT TESTING QA IN PC/ED. PC/ED PPT QA NOTE 1 DIAGNOSE ALL PCM DTCS. PCM IS NOT CURRENTLY RESPONDING. GO TO WORKSHOP 418-00 AND SYMPTOM CHART TELLS ME TO USE PPT A. A1 YES, A2 YES, A3 NO 0.00 OHMS, A4 C175B-67 TO C2431-20 .4 OHMS, C175B-66 TO C2431-19 .4 OHMS. A5, YES. TESTED ALL POWER AND GROUND CIRCUITS BY LOAD TESTING. ALL CIRCUITS WERE FOUND TO LIGHT THE TEST BULB AS BRIGHT AS DIRECTLY OFF OF THE BATTERY.",01-JAN-0001,S07,1," $6,825.00 "," $2,470.81 "," $1,050.80 ",X,This vehicle line not referenced on Ford AFW as applicable to this AF%.,,3.076712329,,,,,,,,,,,,,,,,,,
2022,47.6, $70.94 , $128.94 , $36.84 ,0,0,0,0, $199.88 ,2738309,1FT8W3BN1NEC04795,20523,1352101,LU5Z-15604-BA,LU5Z,15604,BA,F7,13149,13-Mar-23,13-Jan-23,NJ,USA,NA,14-Aug-21,14-Sep-21,USA,A66,"cs tpms light is on for 3 tires they all dropped out with no pressure on dash - has dtc`s for power steering mod (U0131), camera (C1001) and tpms ( B124D) check and advise CONTINUE TECH NOTES: almost 100 miles no tpms issue m time used for multiple road test and multiple replacements of bcm total of 6 bcm`s with the help of the fse involved",42,verified customer concern of tpms light on and sensors not reading using fdrs performed self test retrieved dtc code: b124d:02-8 and c1001:97-68 present in memory refer to wsm performed pin point test (c) 1-yes b124d 2-yes b124d 3-no 4-no 5-yes 6-no using fdrs monitor pids for tpms in bcmfound back two sensors not reading as per ppt c-6 states to install new tpms sensor not working properly remove and replace both rear tpms sensors and road test sensors cut out on screen and tpms light back on monitor pids again found tire pressures reading in outer tire pressure when vehicle is single wheel should be reading inner tpms sensors as single wheel perform as built on bcm as per hotline # 119811266 concern still present road test concern still present order bcm and go to replace bcm remove and replace bcm programming fail try pmi and bcm won`t configure order another bcm won`t program or configure follow hotlinerequest check vehicle for aftermarket items found led lights disconnect from vehicle program won`t go through set voltage with battery tender still won`t go through replace bcm again with a 3rd as per hotline installed 3rd bcm program still failing at same point order 4th bcm as per hotline suspect bcm issue receive 4th bcm won`t program fail at same point hotline referred concern to fse after talking to fse wanted me to check powers and grounds to bcm and communication lines to bcm from gwm remove screen and dash pieces ohm wires from gwm to bcm .3 ohms pass checks power and ground all pass load test all ok tell fse all powers and grounds fse tole to order another bcm and order another bcm remove and replace bcm won`t program fail again same spot advise fse order another bcm with note for different bcm build date receive program still fail find truck on our lot with same bcm part number remove bcm from stock truck swapped bcm into truck configure bcm fse said to leave bcm in truck put new bcm in our stock truck and program bcm program took road test truck almo,01-JAN-0001,E83,2," $6,527.85 "," $2,410.88 "," $1,071.50 ",X,"Dealer clearly states that this issue persisted after multiple TPM and BCM replacements, then found that it was being caused by a faulty BCM >> "" REMOVED AND REPLACED BCM. FOUND BCM NOT COMMUNICATING WITH FDRS.""  Non-Supplier A issue and this is not a valid TPMS warranty claim.",,1.331506849,,,,,,,,,,,,,,,,,,
2022,1.3, $141.88 , $257.88 , $73.68 ,280.5007721,0,0,0, $399.76 ,2627772,1FA6P8LD8N5138758,12610,181807,FR3Z-1007-V,FR3Z,1007,V,ZA,20,02-Mar-23,27-Feb-23,AU,AUS,IM,31-Oct-22,27-Feb-23,AUS,B65,VEHIEL DOES NOT HAVE CORRECT WHEELS THAT WERE ORDERED THE LUSTER NICKEL WHEELS AS PER ATTACHED PHOTOS REQUIRES REPLACEMENT,D4,VEHIEL DOES NOT HAVE CORRECT WHEELS THAT WERE ORDERED THE LUSTER NICKEL WHEELS AS PER ATTACHED PHOTOS REQUIRES REPLACEMENT - RIMS SWAPPED OVER TO NICKLE,,*,4, $145.95 ," $1,977.21 ", $-   ,X,"NO CUSTOMER ISSUE PRIOR TO REPLACEMENT OF WRONG SIZE WHEELS/TIRES FROM FORD.  MOST LIKELY DEALER DID NOT FOLLOW TPMS RELEARN PROCEDURE PROPERLY, OR DID NOT DRIVE VEHICLE LONG ENOUGH TO COMPLETE RELEARN.  DEALER NARRATIVE SHOWS NO VALID TPMS COMPLAINT OR REASON FOR REPLACING FOUR SENSORS UNDER WARRRANTY.",,0,,,,,,,,,,,,,,,,,,
2022,3, $35.47 , $64.47 , $18.42 ,0,0,0,0, $99.94 ,3079779,1FTBF2B67NEC04387,8896,502518A,*-TWC01-*,*,TWC01,*,F7,7889,17-Apr-23,12-Apr-23,CT,USA,NA,21-Jul-21,31-Aug-21,USA,TB3,CHECK FOR TIRES WEARING IMPROPERLY,42,VERIFIED CUSTOMER CONCERN. FOUND TIRES WEARING IMPROPERLY ON BOTH FRONT AND BOTH REAR. CHECKED OVER FRONT END. FOUND NO PROBLEMS IN FRONT END. REPLACED ALL FOUR TIRES AND TEST DROVE. ALL OKAY AT THIS TIME.,01-JAN-0001,1,1, $176.40 ," $1,845.23 ", $730.96 ,X,Dealer makes no mention of TPMS concern.  Tires were replaced due to uneven wear…NOT a TPMS concern.  Not a valid warranty claim.,,1.61369863,,,,,,,,,,,,,,,,,,
2020,0.7, $70.94 , $128.94 , $36.84 ,95.57244783,0,0,0, $199.88 ,10534038,1FT8W3BT5LED90711,A4802,76364802,LC3Z-1007-C,LC3Z,1007,C,F7,37005,10-Feb-23,12-Jan-23,SK,CAN,NA,22-Jul-20,22-Apr-21,CAN,B65,FINISH ON REAR WHEELS COMING OFF,D4,Mounted and balanced 2 tires to new rims. Trained tpms. Wheels torqued to 150 ft lbs. Tires to 80 psi,01-JAN-0001,E84,2, $76.45 ," $1,834.93 ", $493.74 ,X,DEALER CLEARLY STATES WHEEL DELAMINATION…NOT a TPM sensor problem.  This should never been filed as a TPMS warranty claim.,,1.726027397,,,,,,,,,,,,,,,,,,
2019,0.5, $35.47 , $64.47 , $18.42 ,0,0,0,0, $99.94 ,14204319,1FT7W2BT7KEF63262,688,019358A,HC3Z-1007-H,HC3Z,1007,H,F7,35715,06-Apr-23,31-Mar-23,PA,USA,NA,22-Jun-19,16-May-20,USA,B65,"CUSTOMER STATES THAT ONE WHEEL, THE PAINT IS PEELING. REPLACE THE WHEEL THAT IS PEELING.",D4,TECH VERIFIED CUSTOMER CONCERN THAT THE PAINT ON THE WHEEL IS PEELING. TECH RAN OASIS AND FOUND GSB 21-7105. FIGURE 9 OF THE GSB MATCHES THE CUSTOMER CONCERN. TECH REMOVED AND REPLACED THE EFFECTED WHEEL. NO MORE ISSUES WITH THE WHEELS COULD BE FOUND AT THIS TIME.,01-JAN-0001,E84,1, $69.06 ," $1,634.86 ", $621.94 ,X,DEALER CLEARLY STATES WHEEL DELAMINATION…NOT a TPM sensor problem.  This should never been filed as a TPMS warranty claim.,,2.873972603,,,,,,,,,,,,,,,,,,
2022,0.5, $35.47 , $64.47 , $18.42 ,0,0,0,0, $99.94 ,2321276,1FT8W2BT7NEC55517,5195,2228601,LC3Z-1007-G,LC3Z,1007,G,F7,10073,01-Feb-23,23-Jan-23,GA,USA,NA,10-Oct-21,29-Oct-21,USA,B65,CUSTOMER STATES DRIVER SIDE REAR WHEEL IS PEE LING,D4,"VERIFIED CONCERN REPLACED LEFT REAR WHEEL DURING REPLACEMENT THE TPMS SENSOR BROKE , REPLACED TPMS SENSOR AND TRAINED SENSOR , MOUNTEDAND BALNCED TIRE.",01-JAN-0001,E84,1, $74.00 ," $1,425.07 ", $561.39 ,X,DEALER CLEARLY STATES WHEEL DELAMINATION…NOT a TPM sensor problem.  This should never been filed as a TPMS warranty claim.,,1.235616438,,,,,,,,,,,,,,,,,,
2022,8.5, $141.88 , $257.88 , $73.68 ,480.2,0,0,0, $399.76 ,2927917,1FT8W2BT1NEC09374,9554,10083501,*-1A189-*,*,1A189,*,F7,31409,30-Mar-23,28-May-22,TX,USA,NA,18-Aug-21,15-Sep-21,USA,A40,WHEELS/TIRES CUSTOMER STATES TIRE LIGHT/PRESSURE LIGHT COMES ON AFTER WARMED UP,42,"SELF TEST PASS. PERFORMED PPT B, CONFIRMED ALL CIRCUITS INTEGRITY, REPLACED ALL 4 TPMS SENSORS, SENSOR TRAIN AND HORN HONKS, IPC CONFIRMS TRAINING COMPLETION. REFERENCED A PREVIOUS CONTACT WHEN THE SECONDARY CELLULAR ANTENNA WAS CAUSING RFI ISSUES. LOWERED HEADLINER, REROUTED AND COVERED ANTENNA, CONCERN STILL PRESENT. CONVERN STILL PRESENT, DIRECTED TO REPLACE TCU PER HOTLINE CONTACT REPLACED TCU, RETEST, ALL OK",01-JAN-0001,E84,5," $1,024.84 "," $1,331.33 ", $380.38 ,X,"Dealer clearly states: ""SECONDARY CELLULAR ANTENNA WAS CAUSING RFI ISSUES. LOWERED HEADLINER, REROUTED AND COVERED ANTENNA, CONCERN STILL PRESENT. CONVERN STILL PRESENT, DIRECTED TO REPLACE TCU PER HOTLINE"".  This is not a TPMS issue and should not have been filed as a warranty claim.",,0.698630137,,,,,,,,,,,,,,,,,,
2022,0.5, $35.47 , $64.47 , $18.42 ,0,0,0,0, $99.94 ,2546645,1FT8W3DTXNEC61220,4413,816122C,JC3Z-1007-E,JC3Z,1007,E,F7,23254,23-Feb-23,13-Feb-23,TX,USA,NA,21-Sep-21,07-Oct-21,USA,B65,Customer states right rear wheel peeling.,D4,"Verified concern, replaced wheel asy ans TPMS sensor. Verified repair.",01-JAN-0001,E84,1, $58.70 ," $1,257.62 ", $481.79 ,X,DEALER CLEARLY STATES WHEEL DELAMINATION…NOT a TPM sensor problem.  This should never been filed as a TPMS warranty claim.,,1.353424658,,,,,,,,,,,,,,,,,,
2020,0.5, $35.47 , $64.47 , $18.42 ,185.7339825,0,0,0, $99.94 ,11045329,1FT7W2BT3LEE00593,A3258,77046906,HC3Z-1007-K,HC3Z,1007,K,F7,33398,10-Apr-23,06-Apr-23,NL,CAN,NA,03-Aug-20,18-Sep-20,CAN,B65,REPLACE PASSENGER FRONT RIM,42,REPLACE PASSENGER FRONT RIM PASSENGER FRONT RIM - REPLACED TIRE PRESSURE SET TO SPEC/BALANCE TORQUE./RETORQUE AFTER 100KMS,01-JAN-0001,E84,1, $53.38 ," $1,184.85 ", $323.27 ,X,DEALER CLEARLY STATES WHEEL DELAMINATION…NOT a TPM sensor problem.  This should never been filed as a TPMS warranty claim.,,2.547945205,,,,,,,,,,,,,,,,,,
