2022,0.5, $35.47 , $64.47 , $18.42 ,0,0,0,0, $99.94 ,2370244,1FT8W3DT9NEE39408,869,762077D,FR3Z-1A189-C,FR3Z,1A189,C,F7,5586,06-Feb-23,19-Jan-23,CA,USA,NA,03-May-22,24-Jun-22,USA,A40,TPMS SENSOR LIGHT ON THE DASH BOARD,42,"CONFIRMED TIRE LIGHT ON AND FLASHING, TRIED TO TRAIN ALL TIRES, REAR INNER TIRE NOT RESPONDING. REMOVED TIRE AND REPLACED SENSORS. RETRAINED ALL SENSORS, ALL OK",01-JAN-0001,1,1, $81.00 , $83.01 , $37.02 ,,,,0.57260274,,,,,,,,,,,,,,,,,,
2020,0.5, $35.47 , $64.47 , $18.42 ,0,0,0,0, $99.94 ,10683036,1FT7W2BT0LED84580,5126,405992C,HC3Z-1A189-F,HC3Z,1A189,F,F7,35677,28-Feb-23,23-Feb-23,MO,USA,NA,20-Jul-20,08-Aug-20,USA,A40,CUST STATES THE TIRE LIGHT IS FLASHING ALL THE TIEM. ADVISE,42,"C/S TIRE PRESSURE LIGHT IS ON, VERIFIED CONCERN TESTED TPMS SENSOR AND FOUND NOT READING.... REPLACED TPMS SENSOR AND TRAINED... WORKING GOOD",01-JAN-0001,E84,1, $65.24 , $82.69 , $36.70 ,,,,2.545205479,,,,,,,,,,,,,,,,,,
2021,0.9, $35.47 , $64.47 , $18.42 ,0,0,0,0, $99.94 ,7474144,3FMCR9B67MRA93075,20360,70388702,F2GZ-1A189-A,F2GZ,1A189,A,M4,17518,14-Mar-23,01-Mar-23,AZ,USA,NA,13-Aug-21,15-Sep-21,USA,A40,TIRE PRESSURE LIGHT ON,42,"CONNECTED TO FDRS AND PULLED DTC B124D LEAD TO PPT B. B1 NO, B2 YES, B3 NO, B4 YES If only some of the sensors trained, VERIFY the correct sensors are installed. REFER to: Wheel and Tire (204-04A Wheels and Tires, Disassembly and Assembly). If the correct sensors are installed and do not train, INSTALL a new TPMS sensor for each sensor that failed to train. REFER to: Tire Pressure Monitoring System (TPMS) Sensor (204-04B Tire Pressure Monitoring System (TPMS), Removal and Installation). DISMOUNT THE RIGHT FRONT TIRE, R&R THE TIRE PRESSURE SENSOR, MOUNT AND BALANCE THE TIRE AND TRAINED THE SENSORS.",01-JAN-0001,E84,1, $121.50 , $82.69 , $36.70 ,X,This vehicle line not referenced on Ford AFW as applicable to this AF%.,,1.457534247,,,,,,,,,,,,,,,,,,
2022,0.5, $35.47 , $64.47 , $18.42 ,0,0,0,0, $99.94 ,2883341,1FD8W3HT5NEE83654,5126,408258A,FR3Z-1A189-C,FR3Z,1A189,C,F7,17608,27-Mar-23,21-Mar-23,MO,USA,NA,21-Jun-22,20-Aug-22,USA,A40,RIGHT REAR OUTER DUAL TPMS LIGHT ON CHECK AND ADVISE,42,"VERIFIED CONCERN, RIGHT REAR OUTER TPMS SENSOR FAILING AND NOT WORKING, REPLACED TPMS SENSOR. RETRAINED SENSORS. ALL GOOD",01-JAN-0001,E84,1, $65.24 , $82.69 , $36.70 ,,,,0.583561644,,,,,,,,,,,,,,,,,,
2021,0.7, $35.47 , $64.47 , $18.42 ,0,0,0,0, $99.94 ,7167262,1FD8W3HN2MED57817,2342,789438B,FR3Z-1A189-C,FR3Z,1A189,C,F7,13862,15-Feb-23,31-Jan-23,ND,USA,NA,26-May-21,11-Jun-21,USA,A40,TPMS LIGHT IS ON CHECK AND ADVISE,42,"VERIFIED CUSTOMER CONCERN FOUND TPMS FAULT LIGHT ON, SET ALL TIRE PRESSURES AND LIGHT STAYED ON, PUT VEH INTO TPMS TRAINING MODE AND TRIED TO TRAIN ALL THE SENSORS FOUND THE LEFT REAR OUTER SENSOR WOULD NOT RETRAIN. REPLACED LEFT REAR OUTER SENSOR AND RETRAINED SENSORS AGAIN AND THEY ALL TRAINED, RETURNED VEH TO C USTOMER",01-JAN-0001,E84,1, $107.80 , $82.64 , $36.65 ,,,,1.64109589,,,,,,,,,,,,,,,,,,
2022,0.5, $35.47 , $64.47 , $18.42 ,0,0,0,0, $99.94 ,2350189,1FD8W3DT8NEE83749,8199,917743B,FR3Z-1A189-J,FR3Z,1A189,J,F7,5290,03-Feb-23,18-Jan-23,MO,USA,NA,21-Jun-22,14-Jul-22,USA,A40,LEFT REAR OUTER TIRE SHOWING PSI AT 0,42,#NAME?,01-JAN-0001,1,1, $74.48 , $82.64 , $36.65 ,,,,0.515068493,,,,,,,,,,,,,,,,,,
2021,0.4, $35.47 , $64.47 , $18.42 ,0,0,0,0, $99.94 ,7211855,3FMTK3SU4MMA09033,1912,636438F,F2GZ-1A189-A,F2GZ,1A189,A,ZE,17678,20-Feb-23,17-Jan-23,CA,USA,NA,05-Feb-21,01-Apr-21,USA,A40,CUSTOMER STATES-CHECK TPMS SENSOR W ENTOUT,42,ITEM RETURN 1A189A WARRENTY,01-JAN-0001,E84,1, $64.46 , $82.60 , $36.61 ,X,This vehicle line not referenced on Ford AFW as applicable to this AF%.,,1.797260274,,,,,,,,,,,,,,,,,,
2022,0.5, $35.47 , $64.47 , $18.42 ,0,0,0,0, $99.94 ,3018235,1FT7W2B6XNEC95581,1912,640048B,HC3Z-1A189-F,HC3Z,1A189,F,F7,8228,10-Apr-23,07-Apr-23,CA,USA,NA,10-Oct-21,10-Oct-21,USA,A40,CUSTOMER STATES TPMS FAULT,42,REMOVED AND INSTALLED NEW (LEFT REAR) TIRE SENSOR. 1552AA 0.50,01-JAN-0001,E84,1, $80.57 , $82.60 , $36.61 ,,,,1.490410959,,,,,,,,,,,,,,,,,,
2020,1, $35.47 , $64.47 , $18.42 ,0,0,0,0, $99.94 ,10868322,1FT7W2B65LED24563,4402,54055BB,HC3Z-1A189-F,HC3Z,1A189,F,F7,28358,20-Mar-23,13-Mar-23,TX,USA,NA,19-May-20,30-Jun-20,USA,A40,THE TIRE SENSOR FAULT LIGHT IS COMING ON ATTIMES AFTER START UP,42,"VERIFIED CONCERN. PERFORMED BCE DIAGNOSIS. FOUND B124D:02 TIRE PRESSURE SENSOR: GENERAL SIGNAL FAILURE. PERFORMED PIN POINT TEST I. I1 YES. I2 NO. I3 YES. I4 NO. I5 YES, REPLACE RIGHT FRONT TIRE SENSOR. RETEST AND PASSED.",01-JAN-0001,E84,1, $156.00 , $82.55 , $36.56 ,,,,2.701369863,,,,,,,,,,,,,,,,,,
2020,0.4, $35.47 , $64.47 , $18.42 ,0,0,0,0, $99.94 ,10832541,3FA6P0SU0LR256204,4402,54159BA,HC3Z-1A189-F,HC3Z,1A189,F,DH,15796,15-Mar-23,14-Mar-23,TX,USA,NA,25-Jul-20,26-Aug-20,USA,A40,CUSTOMER STATES HE TOOK THE VEHICLE TO ANOTHERSHOP AND HE WAS TOLD THE DRIVER FRONT TIREPRESSURE SENSOR WAS NOT WORKING. CHECK ANDADVISE,42,VERIFIED CONCERN; PASS FRONT TPMS SENSOR WILL NOT TRAIN; REPLACED FAULTY TPMS SENSOR; ALL OK AT THIS TIME.,01-JAN-0001,E84,1, $62.40 , $82.55 , $36.56 ,,,,2.547945205,,,,,,,,,,,,,,,,,,
2020,0.7, $35.47 , $64.47 , $18.42 ,0,0,0,0, $99.94 ,11176610,3FA6P0HD9LR123786,315,61360701,HC3Z-1A189-A,HC3Z,1A189,A,DE,32119,27-Apr-23,29-Mar-23,PA,USA,NA,12-Sep-19,31-Jul-20,USA,A40,MISCELLANEOUS TPMS LIGHT ON CHECK AND ADVISE,28,"VERIFIED THE CUSTOMER`S CONCERN OF TIRE PRESSURE LIGHT ON. PERFORMED A VISUAL INSPECTION. PERFORMED THE TPMS SENSOR ACTIVATION TO FIND THE LF WAS SUCCESSFUL, THE RF WAS SUCCESSFUL, THE LR WAS SUCCESSFUL, THE RR WAS UNSUCCESSFUL. PERFORMED A QUICK SCAN OF THE TIRE PRESSURE MONITORING SENSORS FINDING THE RR SENSOR IS NOT READING CORRECTLY AT THIS TIME. FOUND THE RR TIRE AIR PRESSURE SENSOR HAS NO SIGNAL. REMOVED AND REPLACED THE RR TIRE AIR PRESSURE SENSOR AND REINSTALLED ALL PARTS REMOVED FOR REPAIRS IN THE REVERSE ORDER. PERFORMED THE TPMS SENSOR LOCATION CALIBRATION. REMOUNTED & BALANCED THE TIRE & WHEEL. CLEARED ALL CODES & VERIFIED CODES DID NOT RETURN. THE SYSTEM IS OPERATING AS DESIGNED. VERIFIED THE CUSTOMER`S CONCERN OF TIRE PRESSURE LIGHT ON. PERFORMED A VISUAL INSPECTION. PERFORMED THE TPMS SENSOR ACTIVATION TO FIND THE LF WAS SUCCESSFUL, THE RF WAS SUCCESSFUL, THE LR WAS SUCCESSFUL, THE RR WAS UNSUCCESSFUL. PERFORMED A QUICK SCAN OF THE TIRE PRESSURE MONITORING SENSORS FINDIN",01-JAN-0001,E84,1, $94.50 , $82.46 , $36.47 ,,,,2.660273973,,,,,,,,,,,,,,,,,,
2020,0.4, $35.47 , $64.47 , $18.42 ,0,0,0,0, $99.94 ,10642678,3FA6P0RU9LR246938,5432,2261862,HC3Z-1A189-F,HC3Z,1A189,F,DH,14801,23-Feb-23,15-Feb-23,CA,USA,NA,22-Jul-20,22-Aug-20,USA,A40,Customer States RIGHT REAR TIRE PRESSURE SENSOR IS NO LONGER REGISTERING. PLEASE CHECK AND ADVISE,42,..1552AA VERIFIED CONCERN. DIAGNOSED AND FOUND FAULTY TIRE PRESSURE SENSOR AT FAULT. REPLACED SENSOR. RETEST. OPERATING TO SPEC,01-JAN-0001,E84,1, $65.63 , $82.41 , $36.42 ,,,,2.484931507,,,,,,,,,,,,,,,,,,
2022,0.4, $35.47 , $64.47 , $18.42 ,0,0,0,0, $99.94 ,2704399,3FMTK4SX3NMA25175,7704,28749904,F2GZ-1A189-A,F2GZ,1A189,A,ZE,3534,09-Mar-23,21-Feb-23,CA,USA,NA,12-Apr-22,06-Jul-22,USA,A40,LIGHT LINE DIAGNOSTIC & REPAIRS CUST STATES THERE IS A LEAK IN THE LEFT REAR TIRE,D8,"CONFIRMED CONCERN. FOUND AIR LEAK AT VALVE STEM. NEEDS NEW VALVE STEM TPMS SENSOR. TPMS and valve stem replaced, tire pressure set to spec wheels torqued to spec. VERIFIED WORKS AS DESIGNED.",01-JAN-0001,1,1, $69.90 , $82.37 , $36.38 ,X,This vehicle line not referenced on Ford AFW as applicable to this AF%.,,0.630136986,,,,,,,,,,,,,,,,,,
2020,0.4, $35.47 , $64.47 , $18.42 ,0,0,0,0, $99.94 ,11156848,3FA6P0D97LR160823,4275,458777B,HC3Z-1A189-F,HC3Z,1A189,F,DE,32754,25-Apr-23,24-Apr-23,AR,USA,NA,07-Feb-20,28-Dec-20,USA,A40,CUSTOMER REQUEST DRIVER REAR TIRE SENSOR IS INPOT. CHECK AND ADVISE,42,WILL NOT RESET WITH SANNER NO SIGNAL FROM TPMS FOUND REAR DRIVER TMPS SENSOR IS INOPT. REPLACED SENSOR. TEST DROVE AND GOOD,01-JAN-0001,E84,1, $57.70 , $82.32 , $36.33 ,,,,2.320547945,,,,,,,,,,,,,,,,,,
2020,0.7, $35.47 , $64.47 , $18.42 ,0,0,0,0, $99.94 ,10713684,1FTBF2B6XLEE07920,6365,617972B,HC3Z-1A189-F,HC3Z,1A189,F,F7,6668,02-Mar-23,24-Feb-23,NY,USA,NA,12-Aug-20,27-Aug-20,USA,A40,"CUSTOMER STATES THE TIRE PRESSURE LIGHT IS ONAND FLASHING, CHECK AND ADVISE",42,"VERIFY CUSTOMER CONCERN, PERFORM EEC TEST RETRIEVED NO CODES, ATTEMPT TO TRAIN SENSORS FOUND RIGHT REAR WOULD NOT TRAIN, REMOVE AND REPLACE RIGHT REAR TPMS, RE TRAIN AND VERIFY ALL OK AT THIS TIME.",01-JAN-0001,E84,1, $100.11 , $82.28 , $36.29 ,,,,2.495890411,,,,,,,,,,,,,,,,,,
2021,0.9, $35.47 , $64.47 , $18.42 ,0,0,0,0, $99.94 ,7052168,3FMTK3R74MMA23918,8387,168367B,F2GZ-1A189-A,F2GZ,1A189,A,ZE,30987,03-Feb-23,23-Jan-23,CA,USA,NA,31-Mar-21,28-Apr-21,USA,A40,CUSTOMER STATES TPMS WARNING ON DISPLAY. CHECK AND ADVISE,42,"VERIFIED CONCERN. PERFORMED SELFTEST, CODE B124D- TIRE PRESSURE SENSOR. RAN OASIS, NO TSB/SSM FOUND. PERFORMED PINPOINT TEST, FOUND LEFT FRONT TIRE PRESSURE FAULTY. RECOMMEND REPLACE AND RECHECK.",01-JAN-0001,E84,1, $163.80 , $82.28 , $36.29 ,X,This vehicle line not referenced on Ford AFW as applicable to this AF%.,,1.739726027,,,,,,,,,,,,,,,,,,
2022,0.5, $35.47 , $64.47 , $18.42 ,0,0,0,0, $99.94 ,2746159,1FTRF3BT9NED31300,9669,453261B,HC3Z-1A189-F,HC3Z,1A189,F,F7,32857,13-Mar-23,01-Mar-23,MI,USA,NA,07-Dec-21,13-Jan-22,USA,A40,CONCERN OF TPMS LIGHT ON,42,VERIFY LIGHT ON TEST SENSORS FOUND RIGHT REAR NOT RESPONDING DIAG AS BAD SENSOR REMOVE AND REPLACED TEST OK,01-JAN-0001,E84,1, $57.17 , $82.28 , $36.29 ,,,,1.128767123,,,,,,,,,,,,,,,,,,
2022,0.6, $35.47 , $64.47 , $18.42 ,0,0,0,0, $99.94 ,2929256,1FA6P8CF8N5129107,8387,170417A,F2GZ-1A189-A,F2GZ,1A189,A,ZA,4988,30-Mar-23,20-Mar-23,CA,USA,NA,19-Jul-22,04-Nov-22,USA,A40,CUSTOMER STATES TPMS WILL NOT READ ONE SENSOR . CHECK AND ADVISE,42,verified tpms sensor not reading. installed new tpms sensor. works as designed now,01-JAN-0001,1,1, $109.20 , $82.28 , $36.29 ,,,,0.37260274,,,,,,,,,,,,,,,,,,
2022,0.9, $35.47 , $64.47 , $18.42 ,12.93,0,0,0, $99.94 ,2580397,1FT7W2B68NEC46413,8413,1767005,HC3Z-1A189-F,HC3Z,1A189,F,F7,23142,27-Feb-23,27-Jan-23,MT,USA,NA,31-Aug-21,23-Sep-21,USA,A40,WHEELS / TIRES Tire Fault light coming on.,42,verify concern tried to train tpms. l.f. would not train removed and replaced l.f. tpms and trained system working properly.,01-JAN-0001,E84,1, $123.83 , $82.23 , $36.24 ,,,,1.345205479,,,,,,,,,,,,,,,,,,
2022,0.8, $35.47 , $64.47 , $18.42 ,7.15,0,0,0, $99.94 ,2602778,3FMCR9D91NRD53835,8413,1890903,F2GZ-1A189-A,F2GZ,1A189,A,M4,9310,28-Feb-23,22-Feb-23,MT,USA,NA,11-Apr-22,26-May-22,USA,A40,WHEELS / TIRES TPMS SENSOR ON,42,"VERIFIED TPMS SENSOR ON, PULLED CODES NONE. ALL TMPS SENSORS RETRAINED, EXCEPT THE PASS REAR. R&R, RETRAINED, TPMS SENSOR LIGHT OFF",01-JAN-0001,1,1, $110.07 , $82.23 , $36.24 ,X,This vehicle line not referenced on Ford AFW as applicable to this AF%.,,0.745205479,,,,,,,,,,,,,,,,,,
2021,0.4, $35.47 , $64.47 , $18.42 ,0,0,0,0, $99.94 ,7970009,3FMCR9F96MRA13138,6737,098917D,F2GZ-1A189-A,F2GZ,1A189,A,M4,25143,28-Apr-23,27-Apr-23,NY,USA,NA,02-Dec-20,08-Jan-21,USA,A40,Customer states TIRE SENSOR FAULT WARRNING ON AT TIMES,42,"Verified customer concern found left front tpms sensor faulty; Removed and replaced left front TPMS sensor, reprogramed sensor all ok at this time; 1552AA - .4",01-JAN-0001,E84,1, $43.38 , $82.09 , $36.10 ,X,This vehicle line not referenced on Ford AFW as applicable to this AF%.,,2.298630137,,,,,,,,,,,,,,,,,,
2020,0.5, $35.47 , $64.47 , $18.42 ,0,0,0,0, $99.94 ,10464212,1FD8W3HT4LEE47094,5677,74629501,FR3Z-1A189-J,FR3Z,1A189,J,F7,28345,02-Feb-23,02-Feb-23,TN,USA,NA,24-Sep-20,09-Nov-20,USA,A40,CS: INNER PASS REAR TIRE LIGHT ON-CHECK AND ADVISE,42,"TPMS FAULT TRIED RETRAINING TPMS SENSORS 3 TIMES, ALL BUT DRIVER REAR INNER TIRE WOULD TRAIN NEEDS NEW TPMS SENSOR TPMS REPLACED, TRAINED TPMS FAULT LIGHT NOW OFF",01-JAN-0001,E84,1, $60.18 , $82.09 , $36.10 ,,,,2.232876712,,,,,,,,,,,,,,,,,,
2020,0.7, $35.47 , $64.47 , $18.42 ,0,0,0,0, $99.94 ,10964132,1FD8W3HTXLEE72629,5947,126570A,FR3Z-1A189-J,FR3Z,1A189,J,F7,32361,30-Mar-23,17-Mar-23,MS,USA,NA,11-Oct-20,30-Nov-20,USA,A40,C/S TIRE LIGHT IS ON,42,VERIFY CONCERN VISUAL INSPECTION RAN OASIS PER SYMPTOCHART FOLLOW PPT I I1-YES I2-NO I3-YES I4-NO I5-YES REPLACED RIGHT OUTER WHEEL TPMS RETEST AND RESET SYSTEM ALL PASS,01-JAN-0001,E84,1, $99.40 , $81.95 , $35.96 ,,,,2.293150685,,,,,,,,,,,,,,,,,,
2020,0.8, $35.47 , $64.47 , $18.42 ,0,0,0,0, $99.94 ,10520606,1FD8W3FNXLED54312,3145,6501624,HC3Z-1A189-A,HC3Z,1A189,A,F7,24733,09-Feb-23,18-Jan-22,CO,USA,NA,28-May-20,19-Jun-20,USA,A40,CUSTOMER STATES THE LEFT REAR TPMS SENSOR WON`T COMMUNICATE WITH VEHICLE,42,"REPLACED TMPS SENSOR, CALIBRATED SENSOR SYSTEM FUNCTIONS NORMALLY AT THIS TIME",01-JAN-0001,E84,1, $89.60 , $81.86 , $35.87 ,,,,1.583561644,,,,,,,,,,,,,,,,,,
2022,1, $35.47 , $64.47 , $18.42 ,0,0,0,0, $99.94 ,2851230,1FT8W3DT8NEE64025,626,6093901,FR3Z-1A189-J,FR3Z,1A189,J,F7,12106,23-Mar-23,10-Mar-23,WI,USA,NA,31-May-22,24-Jun-22,USA,A40,DIAGNOSE GENERAL CONCERN DIAGNOSE GENERAL CONCERN-----TPMS SENSOR DOES NOT WORK---OUTER PASSENGER REAR DROP OFF,42,"RT Rr TPMS SENSOR Customer states TPMS light on verified concern. Scanned for codes and retrieved code B124D. Performed PPT C. C1-yes, C2-yes,c3-no,C4-no,c5-no go to PPT E. E1 no, E2-no Found left inner rear sensor is dead. Replaced LR inner TPMS sensor and trained all. Verified concern corrected. 1552AA .5hr 12651D .2hr 12651D45 .3hr",01-JAN-0001,E84,1, $159.00 , $81.86 , $35.87 ,,,,0.709589041,,,,,,,,,,,,,,,,,,
2020,0.4, $35.47 , $64.47 , $18.42 ,0,0,0,0, $99.94 ,10619713,3FA6P0HD6LR101051,7251,240024C,JX7Z-1A189-C,JX7Z,1A189,C,DE,31895,21-Feb-23,06-Feb-23,ME,USA,NA,07-Aug-19,28-Jul-20,USA,A40,CUSTOMER STATES RF TPMS FLASHING RA NDOMLY,42,DIAGNOSED AND REPLACED 2 FAILED TPMS SENSORS,01-JAN-0001,E84,1, $42.63 , $81.82 , $35.83 ,,,,2.528767123,,,,,,,,,,,,,,,,,,
2021,0.5, $35.47 , $64.47 , $18.42 ,0,0,0,0, $99.94 ,7291789,1FT8W3DT7MEC96683,3603,416762A,FR3Z-1A189-C,FR3Z,1A189,C,F7,20897,27-Feb-23,17-Feb-23,CT,USA,NA,14-Feb-21,16-Mar-21,USA,TB6,CUST.STATES- R/F TIRE LOSES AIR - 75 PSI,D1,"FOUND THE VALVE STEM LEAKING AIR AND REPLACED, PROGRAMMED THE SENSOR",01-JAN-0001,E84,1, $69.82 , $81.72 , $35.73 ,,,,1.926027397,,,,,,,,,,,,,,,,,,
2022,0.7, $35.47 , $64.47 , $18.42 ,0,0,0,0, $99.94 ,2389751,3FMCR9C69NRD43836,379,687685A,F2GZ-1A189-A,F2GZ,1A189,A,M4,13654,08-Feb-23,31-Jan-23,OH,USA,NA,25-Mar-22,29-Apr-22,USA,A40,CUSTOMER STATES VEHICLE DASH DISPLAYS - "TIRE PRESSURE SENSOR FAULT" LIGHT COMES AND GOES INTERMITTENTLY.CK AND ADV,42,"DO NOT HAVE TPMS SENSOR IN STOCK, PART ORDERED 1/31/23 AND WILL ARRIVE 2/1/23. REMOVED AND REPLACED RIGHT REAR TPMS SENSOR AND REPROGRAMED",01-JAN-0001,E84,1, $88.20 , $81.63 , $35.64 ,X,This vehicle line not referenced on Ford AFW as applicable to this AF%.,,0.75890411,,,,,,,,,,,,,,,,,,
2020,0.4, $35.47 , $64.47 , $18.42 ,0,0,0,0, $99.94 ,10521373,3FA6P0SU1LR181187,359,167031A,HC3Z-1A189-F,HC3Z,1A189,F,DH,9460,09-Feb-23,16-Jan-23,CA,USA,NA,27-Feb-20,30-May-20,USA,A40,CUSTOMER STATES THE TPMS IS STILL NOT READINGPLEASE CHECK AND ADVISE,42,"REMOVED AND REPLACED FAILED TPMS SENSOR, PERFORMED TPMS TRAINING. ALL TIRE SENSORS TRAINED.",01-JAN-0001,E84,1, $78.00 , $81.59 , $35.60 ,,,,2.632876712,,,,,,,,,,,,,,,,,,
2022,0.6, $35.47 , $64.47 , $18.42 ,0,0,0,0, $99.94 ,3192561,3FMCR9A67NRD93363,3890,740276A,F2GZ-1A189-A,F2GZ,1A189,A,M4,6067,27-Apr-23,26-Apr-23,MO,USA,NA,07-Jul-22,24-Oct-22,USA,A40,C/S: TIRE PRESSURE SENSOR FAULT,42,VERIFIED THAT THE TPMS FAULT LIGHT WAS PRESENT. PUT VEHICLE INTO TRAINING MODE AND ATTEMPTED TO TRAIN ALL TIRES. FOUND THAT THE PASSENGER FRONT TIRE SENSOR WAS NOT RESPONDING. REMOVED AND REPLACED TIRE PRESSURE SENSOR AS PER WSM. TRAINED ALL 4 TIRE SENSORS AND FAULT IS NOT LONGER PRESENT.,01-JAN-0001,1,1, $77.10 , $81.59 , $35.60 ,X,This vehicle line not referenced on Ford AFW as applicable to this AF%.,,0.504109589,,,,,,,,,,,,,,,,,,
2020,1.1, $35.47 , $64.47 , $18.42 ,0,0,0,0, $99.94 ,10987747,1FT8W3BT9LEE19188,6192,549112D,HC3Z-1A189-F,HC3Z,1A189,F,F7,20905,03-Apr-23,31-Mar-23,TX,USA,NA,24-Aug-20,05-Sep-20,USA,A40,CUSTOMER STATES FRONT PASSENGER TPMS IS NOT WORKING,42,"CASUAL PART NUMBER1A189-VERIFIED CUSTOMERS CONCERN. TPMS LIGHT ON. PERFORMED SELF TEST. B124D. RUN OASIS FOR TSB OR SSM. NONE TO APPLY. PERFORMED PPT PER DTC. PPT I1=YES, I2=NO, I3=YES= I4=NO, PASSENGER FRONT SENSOR DID NOT TRAIN. I6=YES ALL EXPECT FRONT RIGHT DID NOT TRAIN. DIRECTED TO REMOVE AND REPLACE FRONT RIGHT TPMS SENSOR. REMOVED AND REPLACED FRONT RIGHT TPMS SENSOR AND PROGRAMMED. PERFORMED RETEST. ALL OK AT THIS TIME.",01-JAN-0001,E84,1, $192.50 , $81.54 , $35.55 ,,,,2.567123288,,,,,,,,,,,,,,,,,,
2022,0.5, $35.47 , $64.47 , $18.42 ,0,0,0,0, $99.94 ,2784450,1FT8W2BT3NEC20960,8173,62444202,*-1A189-*,*,1A189,*,F7,17895,16-Mar-23,14-Mar-23,AR,USA,NA,16-Aug-21,04-Sep-21,USA,A40,ELECTRICAL CS THE TPMS LIGHT IS STAYING ON. SHOWING LEFT REAR FAULT.,42,Went to program Left Rear TPMS. Left Rear TPMS would not program. R&R TPMS. Programmed new TPMS to vehicle. JOB COMPLETE. 711,01-JAN-0001,E84,1, $60.00 , $81.54 , $35.55 ,,,,1.523287671,,,,,,,,,,,,,,,,,,
2022,0.5, $35.47 , $64.47 , $18.42 ,0,0,0,0, $99.94 ,3093932,1FT8W2BTXNEF09947,8173,62523502,*-1A189-*,*,1A189,*,F7,35647,18-Apr-23,05-Apr-23,AR,USA,NA,30-Jul-22,07-Oct-22,USA,A40,ACCESSORIES C/S THE TPMS LIGHT IS COMING ON EVERY DAY.,42,"Verified customers concern and found the LR TPMS was not reading or responding to programing. Replaced the sensor on Left Rear tire, and trained all sensors. Sensors are all reading properly after test drive now. Repair complete. ***NOTE**** VEHICLE CAME IN ON THE 5TH OF APRIL WITH MILEAGE OF 35647 AT TIME OF WRITE UP. SELF APPROVAL DDME MILEAGE IS CORRECT FOR THE DAY THE CUSTOMER BROUGHT IN FOR REPAIR.",01-JAN-0001,E84,1, $60.00 , $81.54 , $35.55 ,,,,0.493150685,,,,,,,,,,,,,,,,,,
2020,0.7, $35.47 , $64.47 , $18.42 ,0,0,0,0, $99.94 ,10870040,1FT8W3DT2LEE63160,8202,31302503,FR3Z-1A189-J,FR3Z,1A189,J,F7,16074,20-Mar-23,16-Mar-23,WA,USA,NA,17-Sep-20,11-Oct-20,USA,A40,"Customer states the TPMS light is on, please check and advise.",42,TESTED THE TPMS SENSOR FOUND THE DRIVER FRONT SENSOR TO BE DEAD REPLACED SENSOR AND VERIFIED PROPER OPERATION,01-JAN-0001,E84,1, $114.10 , $81.36 , $35.37 ,,,,2.42739726,,,,,,,,,,,,,,,,,,
2020,0.5, $35.47 , $64.47 , $18.42 ,0,0,0,0, $99.94 ,10556723,1FT8W3DT5LED31137,601,278179A,FR3Z-1A189-C,FR3Z,1A189,C,F7,10813,14-Feb-23,10-Feb-23,NY,USA,NA,27-May-20,12-Sep-20,USA,A40,C/S DRIVERS INNER TIRE PRESSURE SENSORE SHOWS DASHED LINES,42,"FOUND TIRE SENSOR INOP. REMOVED LEFT REAR WHEELS, REMOVED LEFT REAR INNER TIRE AND PRESSURE SENSOR, REPLACED SENSOR WITH NEW. MOUNTED AND BALANCED TIRE, SET PRESSURE TO SPEC AND INSTALLED WHEEL ON VEHICLE.",01-JAN-0001,E84,1, $71.21 , $81.26 , $35.27 ,,,,2.41369863,,,,,,,,,,,,,,,,,,
2022,0.6, $35.47 , $64.47 , $18.42 ,0,0,0,0, $99.94 ,2346700,1FDXE4FN2NDC07723,601,277007C,FR3Z-1A189-C,FR3Z,1A189,C,E1,4118,03-Feb-23,01-Feb-23,NY,USA,NA,17-Feb-21,22-Feb-21,USA,A40,CUSTOMER STATES THE TPMS FAULT MESSAGE ISON,42,"INSPECTED AND VERIFY TPMS FAULT MESSAGE IS ON, CHECKED AND FOUND THE LH REAR INNER SENSOR NOT READING. CHECKED TIRE PSI AND FOUND GOOD, ATTEMPTED TO TRAIN AND FOUND NO RESPONSE. DISMOUNTED BEAD AND FOUND NO DAMAGE TO THE SENSOR, REPLACED LT INNER SENSOR. RE- ASSEMBLED AND TRAINED SYSTEM, FOUND THE LH INNER SENSOR WILL TRAIN BUT THE OUTER SENSOR WILL NOT. MOUNTED WHEEL TO AXLE AND FOUND THE INNER SENSOR READS 1 PSI AND THE OUTER READS 80 WHICH IS CORRECT. TEST DROVE AND FOUND AFTER DRIVING THE INNER PSI NOW READS CORRECTLY, ALL OK",01-JAN-0001,E84,1, $85.45 , $81.26 , $35.27 ,,,,1.942465753,,,,,,,,,,,,,,,,,,
2022,0.5, $35.47 , $64.47 , $18.42 ,0,0,0,0, $99.94 ,2690459,1FT8W3DT0NEC56737,4989,258694A,FR3Z-1A189-C,FR3Z,1A189,C,F7,5178,08-Mar-23,06-Mar-23,FL,USA,NA,22-Sep-21,07-Oct-21,USA,A40,CUSTOMER STATES TMPS LIGHT IS ON,42,VERIFY REAR DRIVER TIRE SENSOR STAYS ON REPLACE SENSOR AND PROGRAM,01-JAN-0001,E84,1, $72.49 , $81.26 , $35.27 ,,,,1.410958904,,,,,,,,,,,,,,,,,,
2020,0.6, $35.47 , $64.47 , $18.42 ,0,0,0,0, $99.94 ,10871647,3LN6L5LU0LR620263,10011,74368201,HC3Z-1A189-F,HC3Z,1A189,F,ZH,24000,20-Mar-23,06-Mar-23,MI,USA,NA,21-Jul-20,31-Aug-20,USA,A40,ADV OF TPMS SENSOR RO 742127,42,"CC42,PART#1A189 PASS REAR SENSOR WOULD NOT TRAIN,DISMOUNTED TIRE,REPLACED SENSOR,OLD SENSOR RETURNED TO PARTS,MOUNTED AND BALANCED TRAINED ALL SENSORS,NO FURTHER ISSUES AT THIS TIME",01-JAN-0001,E84,1, $77.37 , $81.13 , $35.14 ,,,,2.512328767,,,,,,,,,,,,,,,,,,
2022,1.4, $35.47 , $64.47 , $18.42 ,0,0,0,0, $99.94 ,2587690,1FT7W2BN1NEE61784,8063,270579A,HC3Z-1A189-F,HC3Z,1A189,F,F7,8885,27-Feb-23,24-Feb-23,MA,USA,NA,03-Jun-22,17-Jun-22,USA,A40,CS TPMS SENSOR FAULT (FRONT DRIVERS SIDE),42,"verified complaint that the tire fault light is on, scanned for codes had code b124d present. checked for ssm tsb fsa none found performed ppt c c1 yes. c2 yes c3 no c4 checked all tire pressures and set to factory spec no. c5 trained tpms sensors and right rear tire sensor wouldnt train directed to ppt E. El no E2 directed to install new sensor in the right rear tire. removed tire installed new tpms sensor balanced tire and programmed sensor to vehicle. verified repair vehicle is ok at this time",01-JAN-0001,1,1, $274.31 , $81.13 , $35.14 ,,,,0.690410959,,,,,,,,,,,,,,,,,,
2022,0.4, $35.47 , $64.47 , $18.42 ,0,0,0,0, $99.94 ,2961024,3FMCR9C67NRD19180,8946,7611801,F2GZ-1A189-A,F2GZ,1A189,A,M4,19250,03-Apr-23,29-Mar-23,GA,USA,NA,22-Feb-22,05-Apr-22,USA,A40,TIRE C/S TPMS SENSOR,42,slow leak and tpms sensor would not connect to the vehicle WORN technician plugged right rear tire and installed tpms sensor,01-JAN-0001,E84,1, $53.18 , $80.85 , $34.86 ,X,This vehicle line not referenced on Ford AFW as applicable to this AF%.,,0.980821918,,,,,,,,,,,,,,,,,,
2021,0.7, $35.47 , $64.47 , $18.42 ,0,0,0,0, $99.94 ,7847368,1FT7W2BN3MED26059,26,211986D,HC3Z-1A189-F,HC3Z,1A189,F,F7,21000,18-Apr-23,21-Mar-23,NY,USA,NA,09-Apr-21,28-Apr-21,USA,A40,TIRES C/S DASH READS TPMS SENSOR RIGHT REAR AT 0 PSI CK AND ADVISE,42,CKD AND VERIFY CONCERN TPMS SENSOR ERROR ON MESSAGE SCREEN - ATTEMPT TO TRAIN ALL SENSORS AND RIGHT REAR SENSOR WONT READ - R&R SENSOR IN R/R TIRE AND THEN TRAIN ALL SENSORS AND ALL OK AT THIS TIME,01-JAN-0001,E84,1, $108.50 , $80.80 , $34.81 ,,,,1.895890411,,,,,,,,,,,,,,,,,,
2022,0.5, $35.47 , $64.47 , $18.42 ,0,0,0,0, $99.94 ,2814137,1FT7X2B68NEC68151,5618,2302482,HC3Z-1A189-F,HC3Z,1A189,F,F7,20677,20-Mar-23,09-Mar-23,KY,USA,NA,14-Sep-21,28-Sep-21,USA,A40,tire pressure light is on,42,tpms sensor light is on . checked tire pressure and is at operating level. tried to retrain front driver side sensor and will not work. replaced driver side front tpms sensor,01-JAN-0001,E84,1, $64.59 , $80.80 , $34.81 ,,,,1.443835616,,,,,,,,,,,,,,,,,,
2021,0.5, $35.47 , $64.47 , $18.42 ,0,0,0,0, $99.94 ,7107749,1FDRF3HN2MED09383,9172,081837D,*-1A189-*,*,1A189,*,F7,18328,09-Feb-23,07-Feb-23,NH,USA,NA,05-Feb-21,07-Sep-21,USA,A40,CHECK FOR TPMS LIGHT IS ON,42,VERIFY CONCERN DG LEFT REAR INNER TPMS FAILED.RR INNER WHEEL REPLACE TPMS RETRAIN RETEST OK,01-JAN-0001,E84,1, $70.00 , $80.80 , $34.81 ,,,,1.419178082,,,,,,,,,,,,,,,,,,
2022,0.7, $35.47 , $64.47 , $18.42 ,0,0,0,0, $99.94 ,2563662,1FT8W2BT1NEC21055,3271,650092B,9L3Z-1A189-A,9L3Z,1A189,A,F7,31084,24-Feb-23,23-Feb-23,FL,USA,NA,16-Aug-21,04-Sep-21,USA,A40,TPMS MESSAGE KEEPS COMING ON DASHES ONLY RANDOMLY CHECK HISTORY LF SEEMS TO BE THE ISSUE,42,REPLACED LEFT FRONT SENSOR. TRUCK HAD THE WRONG TPMS SENSOR INSTALLED IN WHEEL SO TECHNICIAN REPLACED THE SENSOR WITH THE CORRECT SENSOR AND TRAINED ALL TPMS SENSORS. TEST DROVE AFTERWARDS AND NO LIGHT OR MISCOMMUNICATION FROM THE SENSOR.,01-JAN-0001,E84,1, $106.52 , $80.62 , $34.63 ,,,,1.471232877,,,,,,,,,,,,,,,,,,
2022,1.6, $35.47 , $64.47 , $18.42 ,6.65,0,0,0, $99.94 ,3154197,1FT8W3BT9NEF81664,8017,104428C,HC3Z-1A189-F,HC3Z,1A189,F,F7,15176,24-Apr-23,18-Apr-23,IL,USA,NA,06-Oct-22,14-Oct-22,USA,A40,CUSTOMER STS LF TPMS IS NOT WORKING ALL THE TIME,42,"VERIFIED CUSTOMER CONCERN. FOUND HISTORY OF TPMS LIGHT COMING ON FOR LAST COUPLE MONTHS. TPMS LIGHT ON AND B124D 02 C8 STORED IN BCM. PINPOINT TEST C 1Y2Y3N4N5Y6N, REPLACE SENSOR. TESTED BATT VOLTAGE ON SENSORS AND FOUND SENSOR ON FRONT LEFT TO BE LOW. R&R OF SENSOR. TRAINED TPMS AND TESTED FOR PROPER OPERATION OF SYSTEM AND RESOLVE OF CUSTOMER CONCERN. CAUSAL PART TPMS SENSOR, CC 42",01-JAN-0001,E84,1, $212.74 , $80.62 , $34.63 ,,,,0.509589041,,,,,,,,,,,,,,,,,,
2020,0.5, $35.47 , $64.47 , $18.42 ,0,0,0,0, $99.94 ,10582887,1FT7W2BN3LEC29300,9880,2716912,HC3Z-1A189-F,HC3Z,1A189,F,F7,27453,16-Feb-23,13-Feb-23,ID,USA,NA,09-Jan-20,25-Mar-20,USA,A40,CUSTOMER STATES TPMS WARNING LIGHT IS ON CHECK AND ADVISE,42,"FOUND LF WHEEL TPMS SENSOR UNRESPONSIVE TO ALL TPMS PROGRAMMING TOOLS. VERIFIED SENSOR WAS IN TIRE AND INSTALLED PROPERLY. REMOVED AND REPLACED TPMS SENSOR, RETRAINED ALL TPMS SENSORS, OK.",01-JAN-0001,E84,1, $64.62 , $80.57 , $34.58 ,,,,2.890410959,,,,,,,,,,,,,,,,,,
2021,0.5, $35.47 , $64.47 , $18.42 ,0,0,0,0, $99.94 ,7791491,1FT8W3DT9MED77913,2006,327698A,FR3Z-1A189-A,FR3Z,1A189,A,F7,33181,12-Apr-23,06-Apr-23,IN,USA,NA,02-Jul-21,16-Jul-21,USA,TB6,CUST STATES LEFT FRONT TIRE IS LEAKING AIR FROM VALVE STEM AGAIN,D8,"verified cust concern, Replaced valve stem in left front",01-JAN-0001,E84,1, $60.69 , $80.53 , $34.54 ,X,"Dealer report of TPM sensors leaking from around the valve stem typically indicates either improper installation to the wheel at the Ford Assembly Plant, damage by the customer during maintenance, or unapproved, aftermarket valve stem caps installed with a dissimilar metal that causes corrosion of the valve stem (non-supplier responsible).",,1.723287671,,,,,,,,,,,,,,,,,,
