2022,0.7, $35.47 , $64.47 , $18.42 ,0,0,0,0, $99.94 ,2784218,1FT8W3BT6NEF38755,8739,410018B,HC3Z-1A189-F,HC3Z,1A189,F,F7,10743,16-Mar-23,16-Mar-23,LA,USA,NA,06-Sep-22,21-Oct-22,USA,A40,CUSTOMER STATES DRIVERS FRONT TIRE PRESSURE NOTREADING AT,42,PERFORMED BCM TEST REPLACE ONE TIRE SENSOR THE LEFT FRONT TIRE SENSOR WAS NOT WORKING. REPLACED,01-JAN-0001,1,1, $86.07 , $70.73 , $24.74 ,,,,0.4,,,,,,,,,,,,,,,,,,
2022,0.5, $35.47 , $64.47 , $18.42 ,0,0,0,0, $99.94 ,3121642,1FT7W2B63NEG40935,4132,726805,HC3Z-1A189-F,HC3Z,1A189,F,F7,5666,20-Apr-23,19-Apr-23,PA,USA,NA,29-Nov-22,13-Dec-22,USA,TB6,LOW TIRE LIGHT ON AND FOUND VALVE STEM BROKEN,42,"FOUND LR TIRE LOW. FOUND LEAK AT VALVE STEM.REPLACEMENT REQUIRED.DISMOUNTED LR TIRE, REPLCED TPMS. REMOUNTED AND BALANCED TIRE. TRAINED TPMS, ROAD TESTED AND VERIFIED SERVICE COMPLETE",01-JAN-0001,1,1, $57.50 , $70.59 , $24.60 ,,,,0.347945205,,,,,,,,,,,,,,,,,,
2022,0.8, $35.47 , $64.47 , $18.42 ,0,0,0,0, $99.94 ,2370966,1FT8W3BT2NEE33971,6672,9621504,HC3Z-1A189-F,HC3Z,1A189,F,F7,13332,06-Feb-23,31-Jan-23,VA,USA,NA,28-May-22,18-Jul-22,USA,A40,"REPLACE TPMS SENSOR, 01/31/23. TRAIN, SENSOR WILL NOT TRAIN",42,"FOUND TPMS SENSOR WOULD NOT TRAIN AFTER INSTALLATION, DIAG, WSM INSTRUCT TO REPLACE SENSOR, REPALCE TRAIN, RETEST, ALL OKAY @ THIS TIME. DDR3 PER SERVICE MANAGER SPW TO JOB 1 VEHICLE STILL IN WARRANTY",01-JAN-0001,E84,1, $91.26 , $70.18 , $24.19 ,,,,0.539726027,,,,,,,,,,,,,,,,,,
2022,0.5, $35.47 , $64.47 , $18.42 ,0,0,0,0, $99.94 ,2392779,1FTER4FH7NLD32331,3163,1825201,HC3Z-1A189-F,HC3Z,1A189,F,R2,3658,08-Feb-23,03-Feb-23,TN,USA,NA,12-Aug-22,12-Sep-22,USA,A40,TIRE/WHEEL CONCERN CUSTOMER STATES TIRE PRESSURE LIGHT IS ON AND ALL TIRES ARE CORRRECT PRESSURES,42,Dr front TPMS sensor not reading,01-JAN-0001,1,1, $46.63 , $68.48 , $22.49 ,X,This vehicle line not referenced on Ford AFW as applicable to this AF%.,,0.394520548,,,,,,,,,,,,,,,,,,
2020,0.5, $35.47 , $64.47 , $18.42 ,0,0,0,0, $99.94 ,10870440,1FT7W2BN1LED08397,9049,123833A,HC3Z-1A189-F,HC3Z,1A189,F,F7,28930,20-Mar-23,21-Feb-23,WY,USA,NA,11-Feb-20,16-Mar-20,USA,A40,CUST STATES THAT TIRE PRESSURE SENSOR FAULT LIGHT IS ON,42,CUSTOMER STATES TPMS FAULT LIGHT IS ON. CONFIRMED CONCERN USING TIRE TOOL FOUND LR TPMS SENSOR TO BE DEAD REMOVED AND REPLACED SENSOR PER WSM.,01-JAN-0001,E84,1, $54.00 , $64.39 , $18.40 ,,,,2.936986301,,,,,,,,,,,,,,,,,,
2019,0.4, $35.47 , $64.47 , $18.42 ,0,0,0,0, $99.94 ,14152127,1FA6P8K09K5507203,553,4603401,F2GZ-1A189-A,F2GZ,1A189,A,ZA,10144,28-Mar-23,27-Mar-23,PA,USA,NA,07-Aug-19,17-Jun-20,USA,A40,TIRE CONCERN CUSTOMER STATES TPMS LIGHT IS ON,42,"VERIFY CONCERN, FOUND THE LT REAR TPMS SENSOR NOT TRANAMITTING. REPLACED AND TRAINED THE SENSOR, VERIFY REPAIR.",01-JAN-0001,E84,1, $38.98 , $64.39 , $18.40 ,,,,2.775342466,,,,,,,,,,,,,,,,,,
2020,0.5, $35.47 , $64.47 , $18.42 ,0,0,0,0, $99.94 ,10588488,1FT8W3DT6LED16419,3670,066390A,FR3Z-1A189-C,FR3Z,1A189,C,F7,22105,17-Feb-23,14-Feb-23,UT,USA,NA,16-Feb-20,30-May-20,USA,A40,"TPMS LIGHT KEEPS COMING ON WHEN DRIVING FOR A WHILE, CUST IS LEAVING FOR A WEEK",42,WARRANTY - REPLACED REAR INNER TPMS SENSOR 1007AE 0.60 HRS,01-JAN-0001,E84,1, $65.32 , $64.39 , $18.40 ,,,,2.712328767,,,,,,,,,,,,,,,,,,
2020,0.9, $35.47 , $64.47 , $18.42 ,0,0,0,0, $99.94 ,11105088,3FA6P0HD6LR250480,6177,1160602,HC3Z-1A189-F,HC3Z,1A189,F,DE,32477,18-Apr-23,18-Apr-23,FL,USA,NA,15-Jun-20,19-Aug-20,USA,A40,"Customer states inspect and advise on pass front tpms sensor, only reads 14psi all the time",42,"chassis electrical diag no dtc present, performed pinpoint test per symptom chart. E1 no, NO DTC present. E3 no, spare tire not in use. E4 no, set pressures, lamp still illuminated. E5 yes, all sensors train. E6 no, Monitor tire pressure PID data in BCM. Found RF reading 14 psi while pressure is set at 35. Replace RF TPMS sensor. Train sensors. Retest. Concern no longer present.",01-JAN-0001,E84,1, $93.78 , $64.39 , $18.40 ,,,,2.663013699,,,,,,,,,,,,,,,,,,
2020,0.4, $35.47 , $64.47 , $18.42 ,0,0,0,0, $99.94 ,10855239,1FA6P8CF8L5157924,5427,891011B,F2GZ-1A189-A,F2GZ,1A189,A,ZA,18226,17-Mar-23,16-Mar-23,TX,USA,NA,01-Jul-20,31-Jul-20,USA,A40,SENSOR ASSY - TIRE PRESSURE - FAULT LAMP ON IN CLUSTE R.,42,"TIRE SENSOR REPLACED, DRIVERS REAR.",01-JAN-0001,E84,1, $57.06 , $64.39 , $18.40 ,,,,2.624657534,,,,,,,,,,,,,,,,,,
2020,0.6, $35.47 , $64.47 , $18.42 ,0,0,0,0, $99.94 ,10579377,3FA6P0HD1LR198109,1992,39579004,HC3Z-1A189-A,HC3Z,1A189,A,DE,32781,16-Feb-23,13-Feb-23,KY,USA,NA,05-Feb-20,20-Jul-20,USA,A40,TIRE PRESSURE PASSENGER FRONT TIRE PRESSURE SENSOR NEEDS REPLACEMENT.,41,REPLACED PASSENGER FRONT TIRE SENSOR,01-JAN-0001,E84,1, $69.27 , $64.39 , $18.40 ,,,,2.569863014,,,,,,,,,,,,,,,,,,
2020,0.5, $35.47 , $64.47 , $18.42 ,0,0,0,0, $99.94 ,10926468,1FT7X3B66LEE21807,3719,4264702,HC3Z-1A189-F,HC3Z,1A189,F,F7,28961,27-Mar-23,16-Mar-23,UT,USA,NA,12-Aug-20,04-Sep-20,USA,A40,MISC TPMS light staying on after checking tire presures.,42,"tpms light staying on after filling up tire with air Attempted retrain tpms sensors to no avail. All but the driver rear sensor communicate. Replace sensor due to it not transmitting. Trained sensors, issue had been resolved.",01-JAN-0001,E84,1, $61.33 , $64.39 , $18.40 ,,,,2.528767123,,,,,,,,,,,,,,,,,,
2020,0.4, $35.47 , $64.47 , $18.42 ,0,0,0,0, $99.94 ,10856351,1FA6P8TD9L5169577,8122,1756501,F2GZ-1A189-A,F2GZ,1A189,A,ZA,27690,17-Mar-23,09-Jan-23,KY,USA,NA,26-Jun-20,02-Jul-20,USA,A40,LEFT REAR TIRE PRESSURE LIGHT IS COMING ON..PLEASE ADVISE,42,TESTED AND FOUND FAULTY TPMS SENSOR REPLACED THE SENSOR AND VERIFIED REPAIRS 1A189 .40,01-JAN-0001,E84,1, $54.00 , $64.39 , $18.40 ,,,,2.523287671,,,,,,,,,,,,,,,,,,
2020,0.5, $35.47 , $64.47 , $18.42 ,0,0,0,0, $99.94 ,11060874,1FT8W3DT4LEE26000,2502,17223803,FR3Z-1A189-C,FR3Z,1A189,C,F7,32270,12-Apr-23,04-Apr-23,TX,USA,NA,12-Aug-20,13-Oct-20,USA,A40,TIRE LIGHT ON,42,"VERIFIED CONCERN/ TIRE SENSOR FAULT SHOWING IN MESSAGE CENTER. USED TPMS SENSOR TO RETRAIN TIRES, PASSENGER REAR INNER WHEEL TIRE SENSOR DID NOT RESPOND DURING REPROGRAM. RIGHT REAR INNER WHEEL TPMS SENSOR REQUIRES REPLACEMENT. INSTALLED NEW TPMS SENSOR TO REAR PASSENGER INNER TIRE. REPROGRAMED TIRES & ALL TIRES RESPONDED CORRECTLY. FAULT LIGHT CLEARED FROM MESSAGE CENTER & ROADTEST PASSED. RETURNED TOO CUSTOMER.",01-JAN-0001,E84,1, $58.49 , $64.39 , $18.40 ,,,,2.473972603,,,,,,,,,,,,,,,,,,
2020,0.5, $35.47 , $64.47 , $18.42 ,0,0,0,0, $99.94 ,11126214,1FT8W3DTXLED93472,13475,021856A,*-1A189-*,*,1A189,*,F7,34608,20-Apr-23,20-Apr-23,OK,USA,NA,21-Jul-20,31-Oct-20,USA,A40,"Customer states REAR TIRE SENSOR FAULT, CHECK AND ADVISE.",42,"TIRE SENSOR FAULT,; Had to remove right rear out side tire. Installed replacement TIRE SENSOR Right rear outside. Trained sensors location.",01-JAN-0001,E84,1, $53.96 , $64.39 , $18.40 ,,,,2.468493151,,,,,,,,,,,,,,,,,,
2020,0.4, $35.47 , $64.47 , $18.42 ,0,0,0,0, $99.94 ,10544181,3FA6P0G75LR219538,5757,22285001,*-1A189-*,*,1A189,*,DE,35993,13-Feb-23,09-Feb-23,KY,USA,NA,27-Jun-20,24-Aug-20,USA,A40,INSPECT TIRE cust states tpms fault light on,42,replaced failed tpms sensor,01-JAN-0001,E84,1, $39.03 , $64.39 , $18.40 ,,,,2.463013699,,,,,,,,,,,,,,,,,,
2020,0.5, $35.47 , $64.47 , $18.42 ,0,0,0,0, $99.94 ,11149575,1FTER4EH0LLA85295,20455,30757701,HC3Z-1A189-F,HC3Z,1A189,F,R2,17597,24-Apr-23,19-Apr-23,TX,USA,NA,19-Oct-20,06-Nov-20,USA,A40,TRIM C/S TIRE PRESSURE SENSOR FAULT. CUSTOMER ALREADY WENT TO VIVA AND THEY RESET THE SENSOR. IT CAME B ACK ON 2 DAYS LATER.,42,"LEFT REAR TIRE WAS NOT COMUNICATING, REPLACED TIRE SENSOR AND RETRAINED",01-JAN-0001,E84,1, $76.45 , $64.39 , $18.40 ,X,This vehicle line not referenced on Ford AFW as applicable to this AF%.,,2.449315068,,,,,,,,,,,,,,,,,,
2020,0.4, $35.47 , $64.47 , $18.42 ,0,0,0,0, $99.94 ,10832509,1FA6P8TH1L5172993,4544,25854702,F2GZ-1A189-A,F2GZ,1A189,A,ZA,33035,15-Mar-23,06-Mar-23,TX,USA,NA,03-Sep-20,09-Oct-20,USA,A40,C/S TPMS SENSORS WILL NOT TRAIN,42,BASIC- 1A189 CC-42 RT FT TPMS SENSOR NOT TRAINNING. REMOVED AND REPLACED RT FT TIRE SENSOR AIRED UP TIRES TO SPECS AND RETRAINED TIRE SENSORS.,01-JAN-0001,E84,1, $55.60 , $64.39 , $18.40 ,,,,2.405479452,,,,,,,,,,,,,,,,,,
2020,0.4, $35.47 , $64.47 , $18.42 ,0,0,0,0, $99.94 ,10496960,3FA6P0HD5LR170264,4872,105061C,HC3Z-1A189-F,HC3Z,1A189,F,DE,30465,07-Feb-23,06-Feb-23,TX,USA,NA,27-Jan-20,30-Sep-20,USA,A40,CUSTOMER STATES TIRE SENSOR IS NOT READING CORRECTLY//TPMS sensor is out,X9,Rear driver side TPMS sensor is not reading. Attempted to retrain all TPMS sensors and rear driver side won`t train. Removed wheel and tire and replaced sensor. Reinstalled and retrained all sensors. Sensors all now operating correctly.,01-JAN-0001,E84,1, $41.72 , $64.39 , $18.40 ,,,,2.353424658,,,,,,,,,,,,,,,,,,
2020,0.5, $35.47 , $64.47 , $18.42 ,0,0,0,0, $99.94 ,10914470,1FT8W3DT8LEE17610,5790,828691A,FR3Z-1A189-C,FR3Z,1A189,C,F7,32544,24-Mar-23,14-Mar-23,UT,USA,NA,10-Aug-20,11-Nov-20,USA,A40,CUSTOMER STATES THERE IS A SLOW LEAK IN DRIVER REAR T IRE,42,"VERIFIED CUSTOMERS CONCERN, NECESSARY TO REMOVE TIRE, INSPECT FOR LEAKS. FOUND TIRE LEAK PRESENT COMING FROM VALVE STEM ASSEMBLY. REMOVED AND REPLACED FOLLOWING WSM PROCEDURE, TORQUED TIRE, REPAIR COMPLETE.",01-JAN-0001,E84,1, $68.17 , $64.39 , $18.40 ,,,,2.336986301,,,,,,,,,,,,,,,,,,
2020,0.4, $35.47 , $64.47 , $18.42 ,0,0,0,0, $99.94 ,10963914,3FA6P0G7XLR106099,5805,10285701,HC3Z-1A189-F,HC3Z,1A189,F,DE,28624,30-Mar-23,30-Mar-23,AR,USA,NA,12-Aug-19,03-Dec-20,USA,A40,TPMS LIGHT IS ON ADVISE TPMS LIGHT IS ON,42,replaced TPMS sensor and retrained all sensors,01-JAN-0001,E84,1, $50.62 , $64.39 , $18.40 ,,,,2.320547945,,,,,,,,,,,,,,,,,,
2021,0.4, $35.47 , $64.47 , $18.42 ,0,0,0,0, $99.94 ,7343654,1FDXE4FN8MDC33662,1796,9524603,FR3Z-1A189-C,FR3Z,1A189,C,E1,12626,02-Mar-23,28-Feb-23,UT,USA,NA,29-Oct-20,04-Nov-20,USA,A40,Customer States inside rear wheel is not reading properly for tpms check and advise,42,"TESTED AND RETRAINED ALL TPMS SENSORS, FOUND INSIDE REAR WHEEL NOT PROGRAMMING TPMS, REPLACED TPMS SENSOR AND TRAINED TO VEHICLE, ALL GOOD AT THIS TIME",01-JAN-0001,E84,1, $54.28 , $64.39 , $18.40 ,,,,2.317808219,,,,,,,,,,,,,,,,,,
2020,0.5, $35.47 , $64.47 , $18.42 ,0,0,0,0, $99.94 ,10521257,1FT8W3DT8LEE91822,5962,201807A,FR3Z-1A189-C,FR3Z,1A189,C,F7,30880,09-Feb-23,27-Jan-23,ME,USA,NA,08-Oct-20,31-Oct-20,USA,A40,"C/S: TIRE PRESSURE LIGHT IS ON, TPMS SENSOR ISSUE . SOP PART HERE",42,VERIFIED CONCERN. FOUND CODE B124D STORED FOR TIRES PRESSURE SENSOR SIGNAL. FOLLOWED PIN POINT TEST ACTIVATING ALL SENSORS. PASSENGER FRONT SENSOR FAILS TEST WILL NOT TRAIN. SENSOR FAILED. REPLACE SENSOR. REPLACED PASSENGER FRONT SENSOR. SET PRESSURES AND TRAINED ALL SENSOR. ROAD TESTED VERIFIED REPAIR,01-JAN-0001,E84,1, $70.00 , $64.39 , $18.40 ,,,,2.24109589,,,,,,,,,,,,,,,,,,
2021,0.5, $35.47 , $64.47 , $18.42 ,0,0,0,0, $99.94 ,7644625,1FT8W3DT5MEC06138,6882,166472A,FR3Z-1A189-C,FR3Z,1A189,C,F7,32806,29-Mar-23,29-Mar-23,OK,USA,NA,10-Nov-20,04-Jan-21,USA,A40,"REPLACE TPS SENSOR, SENSOR WILL NOT TRAIN",42,PERFORMED; REPLACED FAULTY TPS SENSOR. TECH 179,01-JAN-0001,E84,1, $73.31 , $64.39 , $18.40 ,,,,2.230136986,,,,,,,,,,,,,,,,,,
2020,0.5, $35.47 , $64.47 , $18.42 ,0,0,0,0, $99.94 ,10638880,1FT8X3DTXLEE43655,654,319327GG,FR3Z-1A189-C,FR3Z,1A189,C,F7,9900,23-Feb-23,30-Dec-22,TX,USA,NA,27-Aug-20,20-Oct-20,USA,A40,TPMS R/R INSIDE TIRE NOT TRAINING,42,"performed pin point test, found passenger rear inside dual tire not train replaced tpms sensor",01-JAN-0001,E84,1, $67.46 , $64.39 , $18.40 ,,,,2.194520548,,,,,,,,,,,,,,,,,,
2021,0.5, $35.47 , $64.47 , $18.42 ,0,0,0,0, $99.94 ,7874878,1FT7W2BT5MEC59642,4462,12240001,HC3Z-1A189-F,HC3Z,1A189,F,F7,34802,20-Apr-23,18-Apr-23,TX,USA,NA,20-Jan-21,20-Feb-21,USA,A40,CUSTOMER STATES TPMS SENSOR ON PASSENGER FRONT WHEEL IS NOT READING,42,FRONT RIGHT WOULD NOT RECONNECT REPLACED UNDER WARRANTY,01-JAN-0001,E84,1, $66.84 , $64.39 , $18.40 ,,,,2.156164384,,,,,,,,,,,,,,,,,,
2021,0.8, $35.47 , $64.47 , $18.42 ,0,0,0,0, $99.94 ,7908759,1FT8W3BT5MEC85149,4405,054752A,HC3Z-1A189-F,HC3Z,1A189,F,F7,19316,24-Apr-23,21-Apr-23,TX,USA,NA,26-Jan-21,06-Mar-21,USA,A40,LOW TIRE LIGHT ON CHECK TPMS,42,"COMPLAINT: CUSTOMER STATES LOW TIRE LIGHT/ SENSOR FAULT LIGHT ON. CONCERN: VERIFIED CUSTOMERS CONCERN. CAUSE: PIN POINT TESTED WITH IDS AND ROTUNDA TPMS SENSOR SCANNER. CAUSE: RR TIRE SENSOR FREQUENCY MODU;ATOR INOP ACTING IRRATIC. DEFECTIVE. CORRECTION REMOVE RR TIRE FROM WHEEL TO ACCESS TPMS SENSOR AND REPLACE WITH NEW. RE-MOUNTED AND BALANCED TIRE AND WHEEL ASSEMBLY AND INSTALLED ON VEHICLE TO MANUFACTURERS SPECS. RE-TRAINED ALL TPMS SENSORS, ROAD TESTED. OK, OP NORMAL. CAUSAL PART NUMBER-1A189. (WARRANTY)",01-JAN-0001,E84,1, $104.00 , $64.39 , $18.40 ,,,,2.126027397,,,,,,,,,,,,,,,,,,
2021,0.8, $35.47 , $64.47 , $18.42 ,0,0,0,0, $99.94 ,7724092,1FT8W3DT8MEC87507,4605,299144A,*-1A189-*,*,1A189,*,F7,31347,05-Apr-23,04-Apr-23,TX,USA,NA,29-Jan-21,27-Mar-21,USA,A40,CUSTOMER STATES VEHICLE SHOWS TPMSF AULT,42,"VERIFIED CUSTOMER CONCERN AMD FOUND THAT REAR OUTER TPMS SENSOR NOT READING,CHECKED WITH FRDS AND FOUND CODE B124D.02.8A TRIED RELEARN AND IT WAS UNSUCCESSFUL REMOVE AND REPLACE TPMS RETEST AND WORKING AS DESIGNED.",01-JAN-0001,E84,1, $110.40 , $64.39 , $18.40 ,,,,2.021917808,,,,,,,,,,,,,,,,,,
2021,0.4, $35.47 , $64.47 , $18.42 ,0,0,0,0, $99.94 ,7863130,3FMCR9F95MRA50262,4544,26328403,F2GZ-1A189-A,F2GZ,1A189,A,M4,27955,19-Apr-23,14-Apr-23,TX,USA,NA,23-Mar-21,10-Apr-21,USA,A40,TIRE LIGHT BLINKING. ADDED BY TECH,42,"TIRE LIGHT WAS BLINKLING, SO I CHECK ALL TPMS SENSORS AND PASSENGER SIDE FRONT TPMS WASNT TRANNING. SO WE WENT AHEAD ADN REPLACE TPMS SENSOR WITH A NEW ONE. RETRAINNED ALL TPMS SENSORS AGAIN AND NOW ALL OF THEM ARE WORKING FINE",01-JAN-0001,E84,1, $55.60 , $64.39 , $18.40 ,X,This vehicle line not referenced on Ford AFW as applicable to this AF%.,,2.010958904,,,,,,,,,,,,,,,,,,
2021,1.1, $35.47 , $64.47 , $18.42 ,0,0,0,0, $99.94 ,7535232,1FTER4FH4MLD14867,662,776224B,HC3Z-1A189-F,HC3Z,1A189,F,R2,22526,20-Mar-23,15-Mar-23,VA,USA,NA,03-Feb-21,12-Apr-21,USA,A40,GENERAL REPAIR CUSTOMER STATES HE HAS ERRORMESSAGE STATING TIRE PRESSURE SENSORFAULT.,42,"VERIFIED CUSTOMER CONCERN, THE TPMS WARNING LIGHT AND MESSAGE ARE ON. HOOKED UP SCANTOOL AND PERFORMED SELFTEST. FOUND CODE B124D:02 - TIRE PRESSURE SENSOR: GENERAL SIGNAL FAILURE. FOLLOWED WSM TO PINPOINT TEST B: B1 CHECK THE BCM (BODY CONTROL MODULE) TPMS (TIRE PRESSURE MONITORING SYSTEM) STATUS (TPMS_STATUS) PID (PARAMETER IDENTIFICATION) AND SENSOR IDENTIFIERS - YES B2 CARRY OUT THE TPMS (TIRE PRESSURE MONITORING SYSTEM) SENSOR TRAINING PROCEDURE - NO, THE LEFT REAR SENSOR DID NOT RESPOND B3 ATTEMPT TO TRAIN THE TPMS (TIRE PRESSURE MONITORING SYSTEM) SENSORS AGAIN - YES, 3 OUT OF THE 4 SENSORS TRAINED. REPLACED THE TPMS SENSOR IN THE LEFT REAR WHEEL. REPERFORMED THE TPMS TRAINING PROCEDURE. THE LEFT REAR WHEEL IS NOW PROGRAMMED TO THE VEHICLE. CLEARED CODES AND CONFIRMED WARNING LIGHTS ARE OF F.",01-JAN-0001,E84,1, $131.35 , $64.39 , $18.40 ,X,This vehicle line not referenced on Ford AFW as applicable to this AF%.,,1.923287671,,,,,,,,,,,,,,,,,,
2021,0.7, $35.47 , $64.47 , $18.42 ,0,0,0,0, $99.94 ,7339195,1FT7W2B67MEC84617,5717,13953201,HC3Z-1A189-F,HC3Z,1A189,F,F7,20950,02-Mar-23,02-Mar-23,KY,USA,NA,31-Jan-21,01-Apr-21,USA,A40,ELECTRICAL Customer states the driver rear tire is not reading.,42,VERIFY CONCERN TRY TO RETRAIN LFT REAR TPMS SENSOR IT WOULD NOT TRAIN REPLACE LFT REAR TPMS SENSOR VERIFY REPAIR,01-JAN-0001,E84,1, $76.70 , $64.39 , $18.40 ,,,,1.917808219,,,,,,,,,,,,,,,,,,
2021,0.7, $35.47 , $64.47 , $18.42 ,0,0,0,0, $99.94 ,7295243,1FT8W3BT7MED90548,8379,21351903,*-1A189-*,*,1A189,*,F7,20919,27-Feb-23,24-Feb-23,UT,USA,NA,02-Jun-21,18-Jun-21,USA,A40,CUSTOMER STATES TPMS FAULT LIGHT ON,42,CP 1A189 VERRIFIED CONCERN RIGHT FRONT TPMS WONT COMMUNICAT REPLACED SENSOR,01-JAN-0001,E84,1, $91.36 , $64.39 , $18.40 ,,,,1.687671233,,,,,,,,,,,,,,,,,,
2021,0.9, $35.47 , $64.47 , $18.42 ,0,0,0,0, $99.94 ,7659675,1FA6P8TD8M5106360,1440,533761C,F2GZ-1A189-A,F2GZ,1A189,A,ZA,14861,30-Mar-23,18-Mar-23,NV,USA,NA,22-Feb-21,07-Aug-21,USA,A40,CUSTOMER STATES THERE IS A TPMS FAULT LIGHT ON PLEASE CHECK AND ADVISE,42,VERIFIED CONCERN. PERFORMED SELF TEST. FOUND NO DTCS PRESENT. FOLLOWED WSM PPT G. G1: NO G2: NO. FOUND RIGHT REAR TPMS SENSOR FAILED INTERNALLY. REMOVED RIGHT REAR WHEEL. REPLACED RIGHT REAR TPMS SENSOR. REINSTALLED WHEEL. RETRAINED TPMS SENSORS. CONCERN NO LONGER PRESENT.,01-JAN-0001,E84,1, $151.65 , $64.39 , $18.40 ,,,,1.610958904,,,,,,,,,,,,,,,,,,
2022,0.5, $35.47 , $64.47 , $18.42 ,0,0,0,0, $99.94 ,3195448,1FT7W2BT0NEC08552,9469,16157802,HC3Z-1A189-F,HC3Z,1A189,F,F7,28844,27-Apr-23,25-Apr-23,TX,USA,NA,05-Sep-21,15-Sep-21,USA,A40,CUSTOMER STATE TIRE SENSOR NOT WORKING,42,VERIFIED C/C. DASH SHOWED RF SENSOR WAS NOT TRAINED ATTEMPTED TO RETRAIN AND FOUND THE RR WAS NOT READING. FOLLOWED PINPOINT TEST I FOR THE GFM. FOUND NO CORRODED WIRES OR MISSING HARDWARE. ATTEMPTED TO RETRAIN AGAIN. RR WAS STILL NO PROGRAMMING. INSTALLED NEW SENSOR AND RETRAINED ALL TIRES. HORN SOUNDED WHEN TRAINING WAS COMPLETE. END OF,01-JAN-0001,E84,1, $70.06 , $64.39 , $18.40 ,,,,1.608219178,,,,,,,,,,,,,,,,,,
2021,0.4, $35.47 , $64.47 , $18.42 ,0,0,0,0, $99.94 ,7097494,1FA6P8TH9M5120609,8281,295405C,F2GZ-1A189-A,F2GZ,1A189,A,ZA,26626,08-Feb-23,12-Jan-23,AL,USA,NA,15-Jun-21,06-Jul-21,USA,A40,INSTALL TPMS SENSOR IN PASS REAR,42,"TPMS FAULT LIGHT WAS ON FRO THE PASSENGER REAR TIRE, TRIED TO RELEARN SENSOR. FAILED, NECESSARY TO REPLACE. 1A189 15524AA 0.4",01-JAN-0001,E84,1, $56.36 , $64.39 , $18.40 ,,,,1.520547945,,,,,,,,,,,,,,,,,,
2022,0.5, $35.47 , $64.47 , $18.42 ,0,0,0,0, $99.94 ,2959582,1FT8W3BT7NEC45558,4436,1493396,HC3Z-1A189-F,HC3Z,1A189,F,F7,26715,03-Apr-23,03-Apr-23,UT,USA,NA,28-Aug-21,28-Sep-21,USA,A40,"Tire Light On for right rear tire, please inspect and adjust as needed",42,Cause: Tire Light is on Tech Story: TIRE LIGHT ON - CUSTOMER STATES TIRE WARNING LIGHT IS ON.RECOMMEND NEW TPMS SENSOR ON PASSANGER REAR TIRE AS SENSOR IS NOT READING WITH VEHICLE. LABOR 0.5 HOURS. SERVICE COMPLETED--REPLACED TPMS SENSOR AND NOW ALL SENSORS ARE WORKING PROPERLY. WARRANTY-- ONE1552AALABOR:0.5,01-JAN-0001,E84,1, $65.50 , $64.39 , $18.40 ,,,,1.512328767,,,,,,,,,,,,,,,,,,
2022,0.5, $35.47 , $64.47 , $18.42 ,0,0,0,0, $99.94 ,2382557,1FT7W2BN5NEC09200,4529,8017652,HC3Z-1A189-F,HC3Z,1A189,F,F7,7946,07-Feb-23,31-Jan-23,TX,USA,NA,31-Jul-21,11-Aug-21,USA,A40,CUSTOMER STATES TIRE SENSOR FAULT,42,CUSTOMER STATES TIRE SENSOR FAULT TESTED ALL SENSORS . FOUND LEFT FRONT TIRE SENSOR BAD. REPLACE SENSOR,01-JAN-0001,E84,1, $55.66 , $64.39 , $18.40 ,,,,1.473972603,,,,,,,,,,,,,,,,,,
2022,0.8, $35.47 , $64.47 , $18.42 ,0,0,0,0, $99.94 ,3121402,1FT8W2BT2NEC86271,4431,765851,HC3Z-1A189-F,HC3Z,1A189,F,F7,28685,20-Apr-23,17-Apr-23,TX,USA,NA,14-Oct-21,05-Nov-21,USA,A40,TMPS SENSOR FAULT,42,"Verified customer concern. TMPS fault. Performed diagnosis. Replaced TPMS sensor. Performed final quick test, no codes present. Normal operation.",01-JAN-0001,E84,1, $99.31 , $64.39 , $18.40 ,,,,1.446575342,,,,,,,,,,,,,,,,,,
2022,0.5, $35.47 , $64.47 , $18.42 ,0,0,0,0, $99.94 ,2892863,1FT8W3DT2NEC74818,1618,37022801,FR3Z-1A189-C,FR3Z,1A189,C,F7,35202,28-Mar-23,20-Mar-23,TX,USA,NA,29-Sep-21,20-Oct-21,USA,A40,C/S DRIVER REAR OUTSIDE TIRE SENSOR IS READING 0 PSI BUT HAS AIR IN IT,42,"VERIFIED CONCERN, REPLACED TPMS SENSOR AND RETEST",01-JAN-0001,E84,1, $60.54 , $64.39 , $18.40 ,,,,1.41369863,,,,,,,,,,,,,,,,,,
2022,0.7, $35.47 , $64.47 , $18.42 ,0,0,0,0, $99.94 ,2580111,1FT8W3BT5NEC61015,7670,813504C,HC3Z-1A189-F,HC3Z,1A189,F,F7,15580,27-Feb-23,22-Feb-23,TX,USA,NA,21-Sep-21,11-Oct-21,USA,A40,CUSTOMER STATES THE RIGHT REAR TPMS IS NOT WORKING.,42,"ADVISE VEHICLE PASS FRONT TIRE HAS A BAD TPMS SENSOR DUE TO NOT TRAINING, ADVISE I REPLACED OLD TPMS SENSOR WITH A NEW WARRANTY TPMS SENSOR, ADVISE NO VALVE STEMS WERE NOT MISSING OR DAMAGE, I SET ALL TIRES BACK TO PROPER LEVEL, I RE-TRAINED ALL TPMS SENSORS, I TOOK OLD TPMS SENSOR TO WARRANTY PARTS, EVERYTHING OKAY AT THIS TIME",01-JAN-0001,E84,1, $88.87 , $64.39 , $18.40 ,,,,1.367123288,,,,,,,,,,,,,,,,,,
2021,0.6, $35.47 , $64.47 , $18.42 ,0,0,0,0, $99.94 ,7935983,1FA6P8TD9M5150366,2980,306073A,F2GZ-1A189-A,F2GZ,1A189,A,ZA,11539,26-Apr-23,27-Mar-23,TX,USA,NA,27-Oct-21,19-Nov-21,USA,A40,0 C/S: CUSTOMER STATES THE TPMS LIGHT IS FLASHING PLEASE CHECK AND ADVISE,42,"CUSTOMER STATES TPMS LIGHT FLASHING, PERFORMED CHECK TIRE PRESSURE ON ALL 4 TIRES AND RE-LEARN SENSORS, NOTICE DRIVER REAR TPMS SENSOR NOT COMMUNICATING. WENT AHEAD AND REMOVE TIRE AND DISMOUNT TIRE REPLACE TPMS SENSOR RE-MOUNT TIRE TOP OFF AIR PRESSURE AND RE- LEARN ALL SENSOR AGAIN, ALL SENSORS PASS TPMS LIGHT TURND OFF.",01-JAN-0001,E84,1, $90.00 , $64.39 , $18.40 ,,,,1.350684932,,,,,,,,,,,,,,,,,,
2022,0.6, $35.47 , $64.47 , $18.42 ,0,0,0,0, $99.94 ,2629979,1FT8W3DT4NEC59334,1917,7029501,FR3Z-1A189-A,FR3Z,1A189,A,F7,25439,02-Mar-23,23-Feb-23,OH,USA,NA,25-Sep-21,19-Oct-21,USA,A40,CS REAR VLAVE STEMS LEAKING RIGHT SIDE LOSSE AIR QUICKER AND NOT READING PROPER PRESSURE,42,TECH INSPECTED FOUND RR VALVE STEM LEAKING AND SENSOR FAILED TECH REPLACED TIRE SENSOR RETEST RECEHCK ALL OK,01-JAN-0001,E84,1, $59.06 , $64.39 , $18.40 ,,,,1.347945205,,,,,,,,,,,,,,,,,,
2022,1, $35.47 , $64.47 , $18.42 ,0,0,0,0, $99.94 ,3153572,1FT7W2BT6NED25763,6177,1175208,HC3Z-1A189-F,HC3Z,1A189,F,F7,28630,24-Apr-23,22-Apr-23,FL,USA,NA,28-Nov-21,22-Dec-21,USA,A40,"CUSTOMER STATERS CHECK TPMS LIGHT IS ON, CHECK AND ADVISE",42,verified customer concern following symptom chart in work shop manual - The vehicle TPMS warning indicator is on continuously and the message center displays LOW TIRE PRESSURE. followed Pinpoint Test C which then led to pinpoint test E due to left front sensor not reading or honking leading to pinpoint test E2 verified left front tpm sensor was the right one and replaced it with a new sensor aired tire to spec and relearned tpm,01-JAN-0001,E84,1, $104.20 , $64.39 , $18.40 ,,,,1.331506849,,,,,,,,,,,,,,,,,,
2022,0.7, $35.47 , $64.47 , $18.42 ,0,0,0,0, $99.94 ,2618790,1FD7X2B6XNEC68163,2617,9372201,HC3Z-1A189-F,HC3Z,1A189,F,F7,15366,01-Mar-23,01-Mar-23,TX,USA,NA,16-Sep-21,29-Nov-21,USA,A40,STANDARD DIAGNOSIS TPMS light on display - RF does not seem to be reading.,X2,"VERIFIED THE CUSTOMER`S CONCERN OF TPMS LIGHT ON DISPLAY. PERFORMED THE TPMS SENSOR ACTIVATION TO FIND THE LF WAS SUCCESSFUL, THE RF WAS UNSUCCESSFUL, THE LR WAS SUCCESSFUL, THE RR WAS SUCCESSFUL. FOUND THE RF TIRE AIR PRESSURE SENSOR HAS NO SIGNAL. REMOVED AND REPLACED THE RF TIRE AIR PRESSURE SENSOR. PERFORMED THE TPMS SENSOR LOCATION CALIBRATION. RESET LOW TIRE PRESSURE LIGHT. THE SYSTEM IS OPERATING AS DESIGNED.",01-JAN-0001,E84,1, $100.10 , $64.39 , $18.40 ,,,,1.252054795,,,,,,,,,,,,,,,,,,
2021,0.4, $35.47 , $64.47 , $18.42 ,0,0,0,0, $99.94 ,7782853,3FMCR9D97MRB34473,8764,4232201,F2GZ-1A189-A,F2GZ,1A189,A,M4,14813,11-Apr-23,11-Apr-23,KY,USA,NA,29-Oct-21,14-Jan-22,USA,A40,CUSTOMER STATES HAS TIRE PRESSURE FAULT MESSAGE IN DASH. CHECK AND ADVISE.,42,"DIAG FOUND RIGHT FRONT TIRE PRESSURE SENSOR BAD. REPLACED & PROGRAMMED TIRE PRESSURE SENSOR,TESTED OPERATION, PASSED.",01-JAN-0001,E84,1, $42.38 , $64.39 , $18.40 ,X,This vehicle line not referenced on Ford AFW as applicable to this AF%.,,1.238356164,,,,,,,,,,,,,,,,,,
2022,0.5, $35.47 , $64.47 , $18.42 ,0,0,0,0, $99.94 ,2877636,1FDRF3HTXNED18588,8073,8714507,FR3Z-1A189-J,FR3Z,1A189,J,F7,28974,27-Mar-23,03-Mar-23,SC,USA,NA,01-Dec-21,29-Dec-21,USA,A40,TIRE PSI LIGHT IS ON,42,CHECKED AND FOUND RF TPMS SENSOR FAULT YREMOVED AND REPLACED TPMS SENSOR CHECKED OK AT THIS TIME,01-JAN-0001,E84,1, $51.86 , $64.39 , $18.40 ,,,,1.175342466,,,,,,,,,,,,,,,,,,
2022,0.5, $35.47 , $64.47 , $18.42 ,0,0,0,0, $99.94 ,2450193,1FD8X3HT0NEC56630,384,251142,*-1552-*,*,1552,*,F7,29908,14-Feb-23,01-Dec-22,AR,USA,NA,10-Sep-21,30-Sep-21,USA,A40,C/S THAT THE TIRE MONITOR WARNING IS ON,42,REPLACED THE RIGHT FRONT TIRE PRESSURE SENSOR TO REPAIR ISSUE,01-JAN-0001,E84,1, $37.97 , $64.39 , $18.40 ,,,,1.169863014,,,,,,,,,,,,,,,,,,
2021,0.6, $35.47 , $64.47 , $18.42 ,0,0,0,0, $99.94 ,7713876,1FA6P8CF0M5156879,2980,305342B,F2GZ-1A189-A,F2GZ,1A189,A,ZA,13767,04-Apr-23,16-Mar-23,TX,USA,NA,18-Dec-21,14-Jan-22,USA,A40,25 C/S: TIRE REPAIR & BALANCE FRONT DRIVER TIRE LOW P RESSURE,42,PASSENGER TIRE REPLACED IN PROGRESS OF RE-LEARN OF TIRE PRESSURE MONITORING SENSORS PASSENGER REAR SENSOR CAME UP FAULTY DUE TO SCANNER UNABLE TO PICK UP TIRE PRESSURE MONITORING SENSOR SIGNAL FROM SENSOR ITSELF. TIRE PRESSURE MONITORING SENSOR REMOVED AND REPLACED WITH NEW AND SCANNER PICKING UP SIGNAL FROM SENSOR. TEST OK SENSOR NOW WORKING. CASUAL 1A189,01-JAN-0001,E84,1, $90.00 , $64.39 , $18.40 ,,,,1.167123288,,,,,,,,,,,,,,,,,,
2021,0.4, $35.47 , $64.47 , $18.42 ,0,0,0,0, $99.94 ,7631213,3FMTK4SXXMME04415,7282,264937A,F2GZ-1A189-A,F2GZ,1A189,A,ZE,14492,28-Mar-23,23-Mar-23,TX,USA,NA,07-Dec-21,31-Jan-22,USA,A40,CUSTOMER STATES FRONT DRIVE SIDE TPMS LIGHT IS ON CC CODE A40,42,"INSPECTED TPMS SENSOR, TPMS WAS SENDING WRONG PSI SIGNAL TO COMPUTER CAUSING TPMS SENSORS LIGHT TO COME OFF, REPLACED TPMS AND IT FIXED THE PROBLEM.",01-JAN-0001,E84,1, $57.20 , $64.39 , $18.40 ,X,This vehicle line not referenced on Ford AFW as applicable to this AF%.,,1.139726027,,,,,,,,,,,,,,,,,,
2022,0.6, $35.47 , $64.47 , $18.42 ,0,0,0,0, $99.94 ,3010248,1FA6P8CF4N5107508,7349,1142311,F2GZ-1A189-A,F2GZ,1A189,A,ZA,7033,07-Apr-23,06-Apr-23,PA,USA,NA,07-Jan-22,16-Feb-22,USA,A40,CUSTOMER STATES TIRE SENSOR FAULT MESSAGE ON DASH,42,VERIFIED CUSTOMER CONCERN. RR TIRE NOT READING REPLACED TIRE SENSOR. TEST DROVE. CONCERN HAS BEEN RESOLVED,01-JAN-0001,E84,1, $66.77 , $64.39 , $18.40 ,,,,1.134246575,,,,,,,,,,,,,,,,,,
