2020,0.5, $35.47 , $64.47 , $18.42 ,0,0,0,0, $99.94 ,10490058,1FTER4EH7LLA60085,4970,22748701,HC3Z-1A189-F,HC3Z,1A189,F,R2,24708,06-Feb-23,03-Feb-23,FL,USA,NA,27-Jul-20,07-Jan-21,USA,A40,ENTER DESCRIPTION / ASSIGN SKILL C/S L/F TPMS SENSOR NOT READING AT ALL,42,"truck put into training mode, all sensors besides driver front trained. driver front tire dismounted tpms replaced. tire then rebalanced and installed back onto vehicle. all tpms retrained.",01-JAN-0001,E84,1, $78.00 , $101.41 , $55.42 ,X,This vehicle line not referenced on Ford AFW as applicable to this AF%.,,2.073972603,,,,,,,,,,,,,,,,,,
2020,0.7, $35.47 , $64.47 , $18.42 ,0,0,0,0, $99.94 ,10591879,1FT8W3BN5LEE57700,5597,513088A,HC3Z-1A189-F,HC3Z,1A189,F,F7,29303,17-Feb-23,17-Feb-23,FL,USA,NA,07-Oct-20,12-Mar-21,USA,A40,C/S FRONT RIGHT TIRE SENSOR WILL NO TRAIN AT ALL POSSIBLE NEEDS TO BE REPLACED,42,CHECKED PASSENGER REAR TPMS SENSOR WOULD NOT READ PSI OF TIRE NO DAMAGE TO THE TPMS SENSOR REPLACED SENSOR WORKING AS ACCORDIN G,01-JAN-0001,E84,1, $125.83 , $101.22 , $55.23 ,,,,1.936986301,,,,,,,,,,,,,,,,,,
2022,0.6, $35.47 , $64.47 , $18.42 ,0,0,0,0, $99.94 ,3020002,1FDXE4FN0NDC01239,3661,7770802,FR3Z-1A189-C,FR3Z,1A189,C,E1,8335,10-Apr-23,04-Apr-23,FL,USA,NA,04-Jan-21,13-Jan-21,USA,A40,"CUSTOMER STATED DRIVERS REAR OUTTER TIRE SENSOR KEEPS FAULTING, INSPECT AND ADVISE",42,"replaced DRIVERS REAR TIRE SENSOR, REPROGRAMMED TO UNIT, PERFORMED DRIVE CYCLE. ISSUES RESOLVED",01-JAN-0001,E84,1, $127.20 , $101.18 , $55.19 ,,,,2.221917808,,,,,,,,,,,,,,,,,,
2020,0.4, $35.47 , $64.47 , $18.42 ,0,0,0,0, $99.94 ,10714315,1FA6P8THXL5184317,2650,491625A,F2GZ-1A189-A,F2GZ,1A189,A,ZA,34832,02-Mar-23,23-Feb-23,FL,USA,NA,28-Sep-20,27-Dec-20,USA,A40,CUST STATES RIGHT FRONT TPMS SENSOR NOT READING,42,"PERFORMING A ROAD TEST, THE TIRE PRESSURE SENSOR LIGHT TURNED ON, CHECKED THE OASIS REPORT FOR TECHNICAL SERVICE BULLETINS, SPECIAL SERVICE MESSAGES AND VEHICLE SERVICE HISTORY. PERFORMED A COMPLETE SYSTEM VISUAL INSPECTION. ACCESSED THE DIAGNOSTIC PORT, PERFORMED A DIAGNOSTIC SCAN TO FIND NO RELEVANT DIAGNOSTIC CODES. FOLLOWING SYMPTOM CHART IN SECTION 204-04B PERFORM PPT E1 ATTEMPTED TO TRAIN THE TPMS (TIRE PRESSURE MONITORING SYSTEM) SENSORS THE RIGHT FRONT SENSOR NOT RESPONDING. E2 CHECKED FOR RADIO FREQUENCY INTERFERENCE; FOUND RIGHT FRONT TIRE WON`T RESPONDING, ALSO THE CORRECT SENSORS IS INSTALLED. TO FIND THE LEFT FRONT TIRE AIR PRESSURE SENSOR IS NOT FUNCTIONING PROPERLY. FURTHER EXAMINATION FOUND THE RIGHT FRONT TIRE AIR PRESSURE SENSOR IS FAULTY. REMOVED THE WHEEL AND REPLACED THE RIGHT FRONT TIRE AIR PRESSURE SENSOR. RESET THE LOW TIRE PRESSURE INDICATOR LIGHT. THE SYSTEM IS NOW OPERATING AS DESIGNED.",01-JAN-0001,E84,1, $59.60 , $101.18 , $55.19 ,,,,2.15890411,,,,,,,,,,,,,,,,,,
2021,0.5, $35.47 , $64.47 , $18.42 ,0,0,0,0, $99.94 ,7399159,1FTER4EH3MLD28213,2650,492114A,ML3Z-1A189-B,ML3Z,1A189,B,R2,35985,08-Mar-23,03-Mar-23,FL,USA,NA,09-Mar-21,02-May-21,USA,A40,CUSTOMER STATES CHECK THE TPMS BECAUSE LIGHT IS ON AND OFF AND IT SHOWINF THE FRONT RIGTH TIRE EVEN WHEN IT HAS PRESSUR E,42,"PERFORMING A ROAD TEST, THE TIRE PRESSURE SENSOR LIGHT TURNED ON, CHECKED THE OASIS REPORT FOR TECHNICAL SERVICE BULLETINS, SPECIAL SERVICE MESSAGES AND VEHICLE SERVICE HISTORY. PERFORMED A COMPLETE SYSTEM VISUAL INSPECTION. ACCESSED THE DIAGNOSTIC PORT, PERFORMED A DIAGNOSTIC SCAN TO FIND NO RELEVANT DIAGNOSTIC CODES. FOLLOWING SYMPTOM CHART IN SECTION 204-04B PERFORM PPT E1 ATTEMPTED TO TRAIN THE TPMS (TIRE PRESSURE MONITORING SYSTEM) SENSORS THE RIGHT FRONT SENSOR NOT RESPONDING. E2 CHECKED FOR RADIO FREQUENCY INTERFERENCE; FOUND RIGHT FRONT TIRE WON`T RESPONDING, ALSO THE CORRECT SENSORS IS INSTALLED. TO FIND THE LEFT FRONT TIRE AIR PRESSURE SENSOR IS NOT FUNCTIONING PROPERLY. FURTHER EXAMINATION FOUND THE RIGHT FRONT TIRE AIR PRESSURE SENSOR IS FAULTY. REMOVED THE WHEEL AND REPLACED THE RIGHT FRONT TIRE AIR PRESSURE SENSOR. RESET THE LOW TIRE PRESSURE INDICATOR LIGHT. THE SYSTEM IS NOW OPERATING AS DESIGNED.",01-JAN-0001,E84,1, $74.50 , $101.18 , $55.19 ,X,This vehicle line not referenced on Ford AFW as applicable to this AF%.,,1.835616438,,,,,,,,,,,,,,,,,,
2020,0.5, $70.94 , $128.94 , $36.84 ,22.25419291,0,0,0, $199.88 ,11045199,3FA6P0SU7LR226617,A2062,11240005,HC3Z-1A189-A,HC3Z,1A189,A,DH,13842,10-Apr-23,05-Apr-23,QC,CAN,NA,01-Jun-20,17-Nov-20,CAN,A40,Leak observed at the right rear front wheel valve.,42,removed replaced 2 right side tpms sensors re-balanced wheel reset tpms Part # TPMS107 (1A189),01-JAN-0001,E84,2, $48.18 , $100.43 , $28.70 ,X,"Dealer report of TPM sensors leaking from around the valve stem typically indicates either improper installation to the wheel at the Ford Assembly Plant, damage by the customer during maintenance, or unapproved, aftermarket valve stem caps installed with a dissimilar metal that causes corrosion of the valve stem (non-supplier responsible).",,2.380821918,,,,,,,,,,,,,,,,,,
2022,0.8, $70.94 , $128.94 , $36.84 ,9.310739148,0,0,0, $199.88 ,2423190,1FT8W3BT1NEC52831,B7183,53495001,*-1A189-*,*,1A189,*,F7,6390,10-Feb-23,23-Jan-23,BC,CAN,NA,13-Sep-21,20-Oct-21,CAN,A40,tire pressure sensor fault KEEPS COMING ON AND OFF SOMETIMES SHOWS NO AIR IN TIRES,42,"tire pressure sensor fault KEEPS COMING ON AND OFF SOMETIMES SHOWS NO AIR IN TIRES re trained tires found both front sensors to be faulty replaced sensors and re trained ok now, found customer had tires on vehicle that are not meant for 80 psi, max tire pressure rating for tire is 65psi set rear tires to 65 as they should not be at 80 recommend customer get correct tires. tpms light may return as rear tires are not set to spec",01-JAN-0001,E84,2, $85.70 , $100.43 , $28.70 ,,,,1.260273973,,,,,,,,,,,,,,,,,,
2022,0.5, $35.47 , $64.47 , $18.42 ,0,0,0,0, $99.94 ,3034176,1FT8W3BNXNEC06044,5848,16160401,HC3Z-1A189-F,HC3Z,1A189,F,F7,19942,11-Apr-23,10-Apr-23,MS,USA,NA,26-Jul-21,21-Aug-21,USA,A40,"BODY/ELECTRICAL C/S:THE TIRE PRESSURE LIGHT IS BACK ON AGAIN, WAS RETRAINED LAST WEEK *CHECK AND ADVISE",42,"Cause: customer complaint of tire pressure light on Correction: verified concern tire pressure sensor light on, checked all tires and sensor - found l/r tire sensor not working - no signs of damage or impact, replaced the lr tire pressure sensor due to not communicating with module, programed, set pressures, and test drove cc 42",01-JAN-0001,E84,1, $71.75 , $100.30 , $54.31 ,,,,1.635616438,,,,,,,,,,,,,,,,,,
2019,0.7, $35.47 , $64.47 , $18.42 ,0,0,0,0, $99.94 ,13925523,3LN6L5KU2KR608194,11325,172888E,HC3Z-1A189-F,HC3Z,1A189,F,ZH,32283,14-Feb-23,01-Feb-23,FL,USA,NA,22-Oct-18,09-Feb-19,USA,A40,"GENERAL REPAIR CONCERN CUSTOMER STATES,TIRE SESOR NOT READING",42,"VERIFIED THE CUSTOMER`S CONCERN. ROAD TESTED THE VEHICLE 1 MILES. PERFORMED A VISUAL INSPECTION. ACCESSED THE DIAGNOSTIC PORT AND PERFORMED A SCAN USING THE IDS TO FIND DIAGNOSTIC TROUBLE CODE B1251:00 WHICH IS RELATED TO TIRE PRESSURE SENSOR LOW BATTERY: NO SUB TYPE INFORMATION. PERFORMED PINPOINT TEST(S) C1 TRAIN THE TPMS (TIRE PRESSURE MONITORING SYSTEM) SENSORS TO DETERMINE THE INOPERATIVE SENSOR BEFORE INSTALLING A NEW SENSOR(S): IF A SENSOR DOES NOT RESPOND, MOVE THE VEHICLE TO ROTATE THE WHEELS AT LEAST ONE-FOURTH OF A TURN AND ATTEMPT TO ACTIVATE THE SAME SENSOR AGAIN. IF THE SENSOR STILL DOES NOT RESPOND, ATTEMPT TO ACTIVATE THE SAME SENSOR AGAIN. IF THE SENSOR STILL FAILS TO TRAIN, ATTEMPT TO TRAIN THE SENSOR WITH THE VEHICLE DOORS OPEN. IF THE SENSOR(S) FAILS TO TRAIN A SECOND TIME, INSTALL A NEW TPMS SENSOR(S). . FURTHER EXAMINATION FOUND THE TIRE PRESSURE MODULE HAS AN INTERMITTENT SHORT CIRCUIT. ACCESSED, REMOVED AND REPLACED THE TIRE PRESSURE MODULE. ROAD TESTED THE VEHICLE 1 MILES TO VERIFY REPAIRS. THE SYSTEM IS NOW OPERATING AS DESIGNED.",01-JAN-0001,E84,1, $130.67 , $100.26 , $54.27 ,,,,3.980821918,,,,,,,,,,,,,,,,,,
2020,0.4, $35.47 , $64.47 , $18.42 ,0,0,0,0, $99.94 ,10487931,3FA6P0HD6LR262872,6421,067046A,HC3Z-1A189-F,HC3Z,1A189,F,DE,10702,06-Feb-23,30-Jan-23,MI,USA,NA,26-Jun-20,30-Jul-20,USA,A40,"CUSTOMER STATES DRIVER FRONT TPMS SENSOR IS NOTWORKING, CHECK AND ADVISE. CUSTOMER STATES TPMSFAULT LIGHT.",42,REPLACED SENSOR,01-JAN-0001,E84,1, $61.14 , $97.82 , $51.83 ,,,,2.504109589,,,,,,,,,,,,,,,,,,
2022,1.1, $35.47 , $64.47 , $18.42 ,0,0,0,0, $99.94 ,2772406,1FD8W3D61NEF31246,4863,40155901,FR3Z-1A189-C,FR3Z,1A189,C,F7,116,15-Mar-23,09-Mar-23,FL,USA,NA,01-Sep-22,,USA,A40,"CUSTOMER STATES TPMS FAULT LIGHT IS ON, CHECK AND ADVISE",42,"Verified customer concern, TPMS fault message and light are displayed. Scanned and found DTC B124D. Performed PPT I. I1 yes, I2 no, I3 yes, I4 no, I5 yes left rear outer sensor would not train. Removed and replaced left rear outer tire pressure monitoring sensor. Re-trained sensor, verified repair.",01-JAN-0001,1,1, $168.30 , $96.99 , $51.00 ,,,,123.2712329,,,,,,,,,,,,,,,,,,
2020,0.4, $35.47 , $64.47 , $18.42 ,0,0,0,0, $99.94 ,10710074,1FA6P8CF8L5108268,4863,40053904,F2GZ-1A189-A,F2GZ,1A189,A,ZA,23387,02-Mar-23,01-Mar-23,FL,USA,NA,12-Sep-19,02-Mar-20,USA,A40,C/S TPMS FAULT IS ON. THINKS IT MIGHT BE LEFT REAR TIRE,46,"verified concern. tried to retrain, driver`s rear will not retrain. replaced driver rear tpms sensor due to dead battery. retrained all sensors. all tpms are working.",01-JAN-0001,E84,1, $61.20 , $96.99 , $51.00 ,,,,2.997260274,,,,,,,,,,,,,,,,,,
2021,0.6, $35.47 , $64.47 , $18.42 ,0,0,0,0, $99.94 ,7123385,3FMCR9B6XMRB34105,7839,597191A,F2GZ-1A189-A,F2GZ,1A189,A,M4,5698,10-Feb-23,08-Feb-23,HI,USA,NA,20-Oct-21,20-Dec-21,USA,A40,CUSTOMER STATES THAT THERE IS A TPMS FAULT. CHECK AND ADVISE.,42,VERIFIED TPMS FAULT MESSAGE IS ON. RAN SELF TEST DTC B124;02-BA FROM BCM. SET TIRE PRESSURE TO SPECS. TRAINED ALL TPMS SENSORS RIGHT FRONT TPMS SENSOR WONT TRAIN. REPLACED RIGHT FRONT TPMS TRAINED ALL TPMS. CLEARED DTC ROAD TEST TPMS FAULT MESSAGE IS OFF.,01-JAN-0001,E84,1, $84.27 , $96.90 , $50.91 ,X,This vehicle line not referenced on Ford AFW as applicable to this AF%.,,1.136986301,,,,,,,,,,,,,,,,,,
2020,1.5, $35.47 , $64.47 , $18.42 ,0,0,0,0, $99.94 ,10739782,3LN6L5LU1LR604119,13641,3749602,HC3Z-1A189-A,HC3Z,1A189,A,ZH,32953,06-Mar-23,28-Feb-23,IL,USA,NA,05-Aug-19,16-Aug-19,USA,A40,ck tire pressure warning light on,42,"verified ck tire pressure light on, hook up ids code b124d perform ppt test e1 yes e2 yes e3 no e4 no e5 no e6 no directed to replace afftected sensor clear code and recheck ok",01-JAN-0001,E84,1, $302.04 , $96.85 , $50.86 ,,,,3.539726027,,,,,,,,,,,,,,,,,,
2020,0.7, $35.47 , $64.47 , $18.42 ,0,0,0,0, $99.94 ,10914011,3LN6L5B91LR608247,9137,628335A,F2GZ-1700-E,F2GZ,1700,E,ZP,27280,24-Mar-23,23-Mar-23,MA,USA,NA,10-Dec-19,23-Jan-20,USA,TB6,"CUSTOMER STATES KEEPS LOSING AIR IN TIRES, ESPECIALLY DRIVERS FRONT. PLEASE AD VISE.",42,VALVE STEMS HAD DEBRIS LODGED UNDER VALVE SEAT CLEANED AND REPLACED VALVE STEMS ON 3 TIRES AND HAD TIRE LIGHT ON FOR SENSOR NOT READING. REMOVED AND REPLACE BAD SENSOR AND VERIFIED OPERATION. CAUSAL PART# 1A189 AND 1 700,01-JAN-0001,E84,1, $86.71 , $96.36 , $39.51 ,,,,3.164383562,,,,,,,,,,,,,,,,,,
2021,0.5, $35.47 , $64.47 , $18.42 ,0,0,0,0, $99.94 ,7356933,1FT8W3DT5MED71526,5472,090682C,FR3Z-1A189-C,FR3Z,1A189,C,F7,5388,03-Mar-23,28-Feb-23,CA,USA,NA,25-Apr-21,05-Oct-21,USA,A40,CUSTOMER STATES THAT TIRE PRESSURE FAULT LIGHTIS ON CHECK AND ADVISE,42,"VERIFIED CONCERN PERFORMED A TPMS SENSOR RETRAIN FOUND REAR OUTER TPMS SENSOR NOT PROGRAMMING, REMOVED OLD SENSOR NOT BROKEN AND REPLACED TPMS SENSOR, REPROGRAMMED NEW SENSOR, CONCERN NO LONGER PRESENT AT THIS TIME, ALL TIRES WERE SET TO SPEC.",01-JAN-0001,E84,1, $74.00 , $95.94 , $49.95 ,,,,1.4,,,,,,,,,,,,,,,,,,
2020,0.4, $35.47 , $64.47 , $18.42 ,0,0,0,0, $99.94 ,10820395,3FA6P0RUXLR189908,1864,388420A,HC3Z-1A189-F,HC3Z,1A189,F,DH,28647,14-Mar-23,10-Mar-23,CA,USA,NA,29-Feb-20,10-Oct-20,USA,A40,TIRE PSI FAULT WARNING ON PER CUST ADVISE TECH9423,42,REPLACED TPMS SENSOR.,01-JAN-0001,E84,1, $65.20 , $95.89 , $49.90 ,,,,2.41369863,,,,,,,,,,,,,,,,,,
2020,0.4, $35.47 , $64.47 , $18.42 ,0,0,0,0, $99.94 ,11052781,1FA6P8CF8L5114667,5428,4805434,F2GZ-1A189-A,F2GZ,1A189,A,ZA,24653,11-Apr-23,03-Feb-23,CA,USA,NA,08-Nov-19,04-Apr-20,USA,A40,"Tire pressure sensor malfunctioning, please check and advise",42,found tpms sensor not training removed and replaced 0.4,01-JAN-0001,E84,1, $78.40 , $95.66 , $49.67 ,,,,2.835616438,,,,,,,,,,,,,,,,,,
2022,0.5, $35.47 , $64.47 , $18.42 ,0,0,0,0, $99.94 ,2759805,1FT8W3BT4NEC81353,4660,9613901,HC3Z-1A189-F,HC3Z,1A189,F,F7,24600,14-Mar-23,14-Mar-23,NH,USA,NA,24-Oct-21,09-Dec-21,USA,A40,MISC TIRE/WHEEL REPAIR C/S LR TIRE SENSOR LIGHT IS ON,42,tried training all tire sensors and found left rear to not communicate. removed tire and replaced sensor. mounted tire and balanced wheel. trained sensors and set tire pressure,01-JAN-0001,E84,1, $95.00 , $95.66 , $49.67 ,,,,1.260273973,,,,,,,,,,,,,,,,,,
2020,0.9, $35.47 , $64.47 , $18.42 ,0,0,0,0, $99.94 ,11093770,3FA6P0G77LR248717,5710,440908B,HC3Z-1A189-F,HC3Z,1A189,F,DE,25849,17-Apr-23,15-Apr-23,MD,USA,NA,15-Jul-20,12-Dec-20,USA,A40,"CUSTOMER STATES TIRE PRESSURE SENSOR FAULT WARNING LIGHT IS ON, PLEASE INSPECT AND ADVISE",42,"VERIFY CONCERN, BODY/CHASSIS ELECTRICAL SYSTEM TEST. NO DTC`S. PERFORMED PIN-POINT TEST. FOUND REAR PASSENGER SIDE TPMS SENSOR FAULTY. REPLACED AND RE-PROGRAMMED. FINAL QUICK TEST: PASS",01-JAN-0001,E84,1, $149.31 , $95.48 , $49.49 ,,,,2.339726027,,,,,,,,,,,,,,,,,,
2022,0.6, $35.47 , $64.47 , $18.42 ,0,0,0,0, $99.94 ,3084860,3FMCR9D95NRD78947,5710,440508B,F2GZ-1A189-A,F2GZ,1A189,A,M4,8019,17-Apr-23,07-Apr-23,MD,USA,NA,20-Jun-22,19-Jul-22,USA,A40,C/S DISPLAY READ TIRE SENSOR FAULT SHOWING LEFT FRONT NOT READING THIS WARNING COMES ON AFTER ABOUT 10/15MINS FOR DRIVING SOMETIMESON A LONGER DRIVE,42,WHEN TRAINING TIRES THE LEFT FRONT TPMS WOULD NOT SUCCESSFULLY TRAIN. REPLACED TPMS AND TRAINED,01-JAN-0001,1,1, $99.54 , $95.48 , $49.49 ,X,This vehicle line not referenced on Ford AFW as applicable to this AF%.,,0.717808219,,,,,,,,,,,,,,,,,,
2020,0.5, $35.47 , $64.47 , $18.42 ,0,0,0,0, $99.94 ,10497409,1FT7W2BT1LEE18946,4617,167952B,HC3Z-1A189-F,HC3Z,1A189,F,F7,32818,07-Feb-23,09-Jan-23,TX,USA,NA,08-Aug-20,30-Sep-20,USA,A40,CUSTOMER STATES LEFT REAR TIRE KEEPS SHOWING THAT ITS LOW ON TIRE PRESSURE CHECK AND ADVISE,42,"TIRE LIGHT WAS ON. TRAIN TIRE SENSORS, LEFT REAR SENSOR WOULD NOT TRAIN. REPLACED TIRE SENSOR AND RETRAIN TIRE SENSORS. TIRE LIGHT TURN OFF",01-JAN-0001,E84,1, $80.00 , $95.20 , $49.21 ,,,,2.276712329,,,,,,,,,,,,,,,,,,
2022,0.5, $35.47 , $64.47 , $18.42 ,0,0,0,0, $99.94 ,3153060,1FT8W3DT0NEC86207,4617,179847A,FR3Z-1A189-C,FR3Z,1A189,C,F7,26783,24-Apr-23,20-Apr-23,TX,USA,NA,21-Oct-21,05-Nov-21,USA,A40,TPMS LIGHT IS ON,42,REPLACED BAD TPMS SENSOR ON RIGHT REAR OUTER TIRE,01-JAN-0001,E84,1, $80.00 , $95.20 , $49.21 ,,,,1.454794521,,,,,,,,,,,,,,,,,,
2020,0.4, $35.47 , $64.47 , $18.42 ,0,0,0,0, $99.94 ,11071613,3FA6P0G70LR261650,4546,80623604,HC3Z-1A189-F,HC3Z,1A189,F,DE,34238,13-Apr-23,10-Apr-23,TX,USA,NA,24-Jul-20,02-Jan-21,USA,A40,"A40 customer states tpms not reading, driver front. chack and advise",28,"Verified concern, found left front TPMS sensor to be inoperative. Remove tire and Clean all moisture from wheel and verified no leaks or damages to wheel or tire. Replace inoperative TPMS sensor & retest, concern no longer present.",01-JAN-0001,E84,1, $61.20 , $95.06 , $49.07 ,,,,2.268493151,,,,,,,,,,,,,,,,,,
2021,0.4, $35.47 , $64.47 , $18.42 ,0,0,0,0, $99.94 ,7705071,3FMCR9B66MRA48905,4615,124262B,F2GZ-1A189-A,F2GZ,1A189,A,M4,33599,03-Apr-23,21-Mar-23,FL,USA,NA,26-Mar-21,29-May-21,USA,A40,D/R TPMS SENSOR WILL RANDOMLY LOSE CONNECTIONPLEASE C HECK.,42,UPON INSPECTION FOUND THAT THE DRIVER REAR SENSOR WAS RANDOMLY LOSING COMMUNICATION WITH THE VEHICLE. AFTER DIAG FOUND THAT THE SENSOR WAS NOT PROPERLY COMMUNICATING WITH THE VEHICLE. TPMS SENSOR WAS FAULTY REPLACED 246 972,01-JAN-0001,E84,1, $71.98 , $95.06 , $49.07 ,X,This vehicle line not referenced on Ford AFW as applicable to this AF%.,,1.810958904,,,,,,,,,,,,,,,,,,
2019,0.4, $35.47 , $64.47 , $18.42 ,0,0,0,0, $99.94 ,14053303,3LN6L5C92KR629623,3269,7688403,HC3Z-1A189-A,HC3Z,1A189,A,ZP,38816,09-Mar-23,08-Mar-23,MN,USA,NA,30-May-19,22-Aug-19,USA,A40,"CUSTOMER STATES-TIRE PRESSURE SENSORS NOT WOK ING, ALWAYS ON",42,"CONFIRMED CUSTOMER CONCERN-TPMS LIGHT ON. ADJUSTED AIR PRESSURES TO CORRECT PRESSURE, TRIED RELEARING SENSOR. RIGHT REAR SENSOR NOT ERELEARNING. RECOMMEND REPLACING RIGHT REAR SENSOR/ REPLACED RIGHT REAR SENSOR, RETEST-TST GOOD. ALL SENSORS READING PROPERLY.",01-JAN-0001,E84,1, $59.82 , $94.65 , $48.66 ,,,,3.545205479,,,,,,,,,,,,,,,,,,
2021,0.4, $35.47 , $64.47 , $18.42 ,0,0,0,0, $99.94 ,7224659,3FMCR9D93MRB06900,3269,7600106,F2GZ-1A189-A,F2GZ,1A189,A,M4,29265,21-Feb-23,06-Feb-23,MN,USA,NA,21-Jul-21,27-Aug-21,USA,A40,CUSTOMER STATES TIRE SENSOR LIGHT ON,42,CUSTOMER STATES TIRE SENSOR LIGHT ON Not a repeat repair. This repair was for the right rear sensor. Previous repair was on the rear left wheel.,01-JAN-0001,E84,1, $59.82 , $94.65 , $48.66 ,X,This vehicle line not referenced on Ford AFW as applicable to this AF%.,,1.446575342,,,,,,,,,,,,,,,,,,
2021,0.4, $35.47 , $64.47 , $18.42 ,0,0,0,0, $99.94 ,7909748,3FMTK3SU8MMA07950,7749,303120I,F2GZ-1A189-A,F2GZ,1A189,A,ZE,21615,24-Apr-23,17-Apr-23,CA,USA,NA,11-Dec-20,18-Feb-21,USA,A40,CUST.STATES TIRE PRESSURE SENSOR WARNING ON SCREEN CHECK AND ADVISE,42,"UPON RETRAINING TIRE SENSORS AFTER COMPLETION OF TIRE REPLACEMENT, FOUND THAT THE RIGHT FRONT TIRE SENSOR WAS BAD/DEAD, REPLACED SENSOR AND VALVE STEM WITH NEW, REINSTALLED TIRE ON RIGHT FRONT AND WAS ABLE TO RETRAIN ALL SENSORS, TEST DROVE AFTER .",01-JAN-0001,E84,1, $86.21 , $94.42 , $48.43 ,X,This vehicle line not referenced on Ford AFW as applicable to this AF%.,,2.15890411,,,,,,,,,,,,,,,,,,
2022,0.6, $35.47 , $64.47 , $18.42 ,0,0,0,0, $99.94 ,3011151,3FMCR9D97NRE11138,8990,9074803,F2GZ-1A189-A,F2GZ,1A189,A,M4,3281,07-Apr-23,04-Apr-23,MA,USA,NA,29-Aug-22,08-Oct-22,USA,A40,CUSTOMER STATES THE LEFT REAR TIRE SENSOR IS INOP. PLEASE CHECK AND ADVISE,42,VERIFIED CONCERN PERFORMED RELEARN TO ALL SENSORS AND LEFT REAR WOULD NOT RELEARN. REPLACED SENSOR AND TRAINED ALL. CUSTOMER`S CONCERN RESOLVED,01-JAN-0001,1,1, $99.63 , $94.37 , $48.38 ,X,This vehicle line not referenced on Ford AFW as applicable to this AF%.,,0.487671233,,,,,,,,,,,,,,,,,,
2022,0.4, $35.47 , $64.47 , $18.42 ,0,0,0,0, $99.94 ,2837359,3FMCR9B6XNRD43295,5291,23876902,F2GZ-1A189-A,F2GZ,1A189,A,M4,9405,22-Mar-23,17-Mar-23,GA,USA,NA,12-Mar-22,28-Apr-22,USA,A40,C/S CHECK TIRE PRESSURE SENSOR UPON INSPECTION TECHNICIAN FOUND TPMS SENSOR,42,BAD REPLACE TPMS SENSOR,01-JAN-0001,1,1, $57.60 , $94.23 , $48.24 ,X,This vehicle line not referenced on Ford AFW as applicable to this AF%.,,0.884931507,,,,,,,,,,,,,,,,,,
2021,0.4, $35.47 , $64.47 , $18.42 ,0,0,0,0, $99.94 ,7082399,3FMTK3R76MMA03119,4809,15783701,F2GZ-1A189-A,F2GZ,1A189,A,ZE,26471,07-Feb-23,06-Feb-23,FL,USA,NA,16-Dec-20,11-Feb-21,USA,A40,TIRE PRESSURE NOT READING ON L.R. TIRE,42,"TRIED TO RETRAIN ALL FOUR TPMS WITH ROTUNDA TRAINER FOUND LEFT REAR TPMS INOP REPLACED LEFT REAR TPMS, RETRAINED AND VERIFIED REPAIR",01-JAN-0001,E84,1, $72.40 , $93.77 , $47.78 ,X,This vehicle line not referenced on Ford AFW as applicable to this AF%.,,1.98630137,,,,,,,,,,,,,,,,,,
2022,0.5, $35.47 , $64.47 , $18.42 ,0,0,0,0, $99.94 ,2479026,1FT7W2BN0NEC27135,4932,234838E,HC3Z-1A189-F,HC3Z,1A189,F,F7,11100,16-Feb-23,15-Feb-23,FL,USA,NA,05-Aug-21,26-Aug-21,USA,A40,TPMS FAULT LIGHT/MESSAGE ON DASH,42,DRIVER SIDE REAR TIRE PRESSURE SENSOR NOT READING. REPLACED SENSOR.,01-JAN-0001,E84,1, $59.46 , $93.64 , $47.65 ,,,,1.473972603,,,,,,,,,,,,,,,,,,
2020,0.7, $35.47 , $64.47 , $18.42 ,0,0,0,0, $99.94 ,10869024,3FA6P0LU1LR148981,5524,533834A,HC3Z-1A189-F,HC3Z,1A189,F,DH,23088,20-Mar-23,16-Mar-23,CA,USA,NA,06-Jan-20,14-Feb-21,USA,A40,ADVISE TIRE PRESSURE SENSOR WARNING LIGHT IS COMING O N,42,"VERIFIED CONCERN. NO DTCS. NO TSBS, SSMS, GSBS. PERFORMED PPT E PER SYMPTOM CHART. E1, NO. E3, NO. E4, NO. E5, YES. E6, NO, REPLACE TPMS. UNMOUNTED VEHICLE TIRE AND REPLACED TPMS. PERFORMED TIRE TRAINING PROCEDURE. SYSTEM OPERATING NORMAL.",01-JAN-0001,E84,1, $112.00 , $93.59 , $47.60 ,,,,2.082191781,,,,,,,,,,,,,,,,,,
2022,0.7, $35.47 , $64.47 , $18.42 ,0,0,0,0, $99.94 ,3176929,1FT8W3BT2NED34180,7820,998435F,HC3Z-1A189-F,HC3Z,1A189,F,F7,22018,26-Apr-23,25-Apr-23,CA,USA,NA,25-Jan-22,21-Feb-22,USA,A40,TECHNICIAN RECOMMENDS REPLACE LEFT REAR TIRE PRESSURE MONITORING SENSOR,42,"REMOVED WHEEL FROM VEHICLE, TOOK TO TIRE MACHINE AND REMOVED TIRE, REMOVED TPMS SENSOR, INSTALLED NEW TPMS SENSOR, RETRAINED SENSORS, SYSTEM OK NOW",01-JAN-0001,E84,1, $155.75 , $93.54 , $47.55 ,,,,1.17260274,,,,,,,,,,,,,,,,,,
2022,0.5, $35.47 , $64.47 , $18.42 ,0,0,0,0, $99.94 ,3017309,1FT8W2BT1NEG13520,7820,996666B,HC3Z-1A189-F,HC3Z,1A189,F,F7,2074,10-Apr-23,01-Apr-23,CA,USA,NA,07-Oct-22,11-Feb-23,USA,TB6,CUSTOMER STATES LEFT FRONT VALVE STEM LEAKING INSPECT AND ADVISE,42,"INSPECTED VEHICLE FOR CUSTOMER CONCERN, FOUND VALVE STEM LEAKING CAUSING TIRE TO LOSE PRESSURE, REC REPLACE LEFT FRONT TIRE VALVE STEMP KIT, REPLACED LEFT FRONT TIRE VALVE. REPAIR VER IFIED.",01-JAN-0001,1,1, $111.25 , $93.54 , $47.55 ,X,"Dealer report of TPM sensors leaking from around the valve stem typically indicates either improper installation to the wheel at the Ford Assembly Plant, damage by the customer during maintenance, or unapproved, aftermarket valve stem caps installed with a dissimilar metal that causes corrosion of the valve stem (non-supplier responsible).",,0.134246575,,,,,,,,,,,,,,,,,,
2020,0.4, $35.47 , $64.47 , $18.42 ,0,0,0,0, $99.94 ,11072962,1FA6P8TH7L5189376,7785,916975B,F2GZ-1A189-A,F2GZ,1A189,A,ZA,34027,13-Apr-23,12-Apr-23,FL,USA,NA,19-Nov-20,13-Mar-21,USA,A40,CUSTOMER STATES THAT THE TIRE PREASURE LIGHT IS ON,42,"VERIFIED CUSTOMER CONCERN. WHEN TRAINING TIRES RR WOULD NOT READ. REPLACED RR SENSOR, AND NOW ALL 4 SENSORS READ.",01-JAN-0001,E84,1, $62.05 , $92.72 , $46.73 ,,,,2.082191781,,,,,,,,,,,,,,,,,,
2022,1, $35.47 , $64.47 , $18.42 ,0,0,0,0, $99.94 ,2552282,1FT8W3BT3NED33653,7785,914565B,HC3Z-1A189-F,HC3Z,1A189,F,F7,15680,23-Feb-23,22-Feb-23,FL,USA,NA,24-Mar-22,19-Apr-22,USA,A40,ELECTRICAL CUSTOMER STATES TPMS LIGHT IS STAYING ON HAS BEEN RESET,42,"TIRE PRESSURES ADJUSTED TO SPEC. 60 PSI FRONT AND 70 PSI REAR. EEC TEST PERFORMED. B124D:02. ELECTRICAL DIAGNOSTIC AND PINPOINT TEST C PERFORMED. LIFT ACCESS GAINED. FX4. TPMS SENSOR TRAINING PERFORMED. ALL SENSORS TRAINED AND READING AT PRESENT. CONTACTED CUSTOMER FOR ADDITIONAL INFORMATION REGARDING PRESSURE READINGS AT TIME OF CONCERN. RETESTED SYSTEM AND FOUND L/FRONT TPMS FAULT. REMOVED WHEEL, DISMOUNTED AND REPLACED FAULTY SENSOR. REASSEMBLED AND BALANCED. REINSTALLED AND TRAINED SENSORS. CLEARED CODE.",01-JAN-0001,E84,1, $155.14 , $92.72 , $46.73 ,,,,0.846575342,,,,,,,,,,,,,,,,,,
2020,0.5, $35.47 , $64.47 , $18.42 ,0,0,0,0, $99.94 ,10881132,1FTER4FH2LLA69999,4841,521770C,HC3Z-1A189-F,HC3Z,1A189,F,R2,17302,21-Mar-23,20-Mar-23,MI,USA,NA,12-Aug-20,14-Sep-20,USA,A40,TPMS LIGHT ON DASH,42,TPMS SENSOR WENT BAD SO SENSOR WAS REPLACED AND AT THIS TIME OK,01-JAN-0001,E84,1, $116.38 , $92.49 , $46.50 ,X,This vehicle line not referenced on Ford AFW as applicable to this AF%.,,2.512328767,,,,,,,,,,,,,,,,,,
2020,1.1, $35.47 , $64.47 , $18.42 ,0,0,0,0, $99.94 ,10736816,1FTBF2B62LED24658,4022,7527402,HC3Z-1A189-F,HC3Z,1A189,F,F7,26017,06-Mar-23,24-Feb-23,SD,USA,NA,04-Mar-20,26-Oct-20,USA,A40,C/S TIRE SENSOR FAULT LIGHT ON RIGHT REAR NOT SHOWING PRESSURE VERIFY CONCERN.,42,CHECK DTC=B124D:02 TIRE PRESSURE SENSOR GENERAL SIGNAL FAILURE OASES=NO APPLICABLE TSB/SSM/FSAPPT C1-YES C2-YES PASSENGER REAR SENSOR DOESNOT RESPOND. PASSENGER REAR TPM SENSOR FAILUEREPLACE RIGHT REAR TPMS AND BALANCE TIRETRAIN TPMS=PASSCLEAR DTC NO TPMS WARNING LIGHTS ALL SENSORSSHOW PRESSURE,01-JAN-0001,E84,1, $144.10 , $92.39 , $46.40 ,,,,2.331506849,,,,,,,,,,,,,,,,,,
2022,1, $35.47 , $64.47 , $18.42 ,0,0,0,0, $99.94 ,3154466,1FT8W3DT8NED72395,7594,1002694,HC3Z-1A189-F,HC3Z,1A189,F,F7,9175,24-Apr-23,21-Apr-23,TX,USA,NA,21-Mar-22,08-Apr-22,USA,A40,CHECK TPMS NOT WORKING PROPERLY,42,CANT GET TO DUPLICATE HOTLINE RESPOND WAS TO GO BACK THRU PPT C AGAIN C1 Y C2 Y C3 N C4 N C5 N DIRECTED TO PPT E1 N E2 N REPLACE RF TIRE SENSOR RETRAIN RETEST PASS,01-JAN-0001,E84,1, $144.66 , $92.16 , $46.17 ,,,,1.035616438,,,,,,,,,,,,,,,,,,
2020,0.4, $35.47 , $64.47 , $18.42 ,0,0,0,0, $99.94 ,10580948,3FA6P0HD5LR253662,6723,027789B,HC3Z-1A189-F,HC3Z,1A189,F,DE,31103,16-Feb-23,10-Feb-23,NC,USA,NA,15-Jun-20,31-Jul-20,USA,A40,CUSTOMER STATES TIRE PRESSURE LIGHT IS ON,42,TEST LR SENSOR TESTED BAD REMOVED AND REPLACED LR SENSOR,01-JAN-0001,E84,1, $64.00 , $92.03 , $46.04 ,,,,2.531506849,,,,,,,,,,,,,,,,,,
2020,0.8, $35.47 , $64.47 , $18.42 ,0,0,0,0, $99.94 ,11078421,1FT7W2A61LED10113,4927,10744403,HC3Z-1A189-F,HC3Z,1A189,F,F7,33190,14-Apr-23,22-Feb-23,GA,USA,NA,20-Feb-20,02-May-20,USA,A40,CUSTOMER STATES THAT THE TPMS LIGHT IS FLASHING CHECK AND ADVISE,42,VERIFIED CUSTOMER CONCERN DID NOT FIND NO TSB/SSM PERFORMED PPT G1 AND G2 FOUND RIGHT FRONT TPMS AT FAULT TOOK TIRE OFF DID NOT FIND ANYTHING OUT SIDE ARE INSIDE TIRE THAT WOULD DAMAGE TPMS SENSOR REPLACED RIGHT REAR TPMS SENSOR REPROGRAMMED TIRES VERIFIED REPAIR,01-JAN-0001,E84,1, $99.65 , $91.98 , $45.99 ,,,,2.810958904,,,,,,,,,,,,,,,,,,
2021,0.7, $35.47 , $64.47 , $18.42 ,0,0,0,0, $99.94 ,7170278,3FMTK3SU5MMA03872,4927,10380902,F2GZ-1A189-A,F2GZ,1A189,A,ZE,11973,15-Feb-23,23-Dec-22,GA,USA,NA,09-Jan-21,23-Feb-21,USA,A40,"CUSTOMER STATES TPMS LIGHT IS ON, SHOWING RIGHT FRONT TIRE LOW. CHECK AND ADVISE",42,"REPLACED TPMS SENSOR PERFORMED PIN POINT TEST E (E1- E5) E1 CHECKED TIRE PRESSURE, E2 RUN SELF TEST NO DTC CODES, E3 NO SPADE TIRE, E4 CALIBRATED ALL 4 TIRES, E5 REPLACE RIGHT FRONT TPMS SENSOR. CALIBRATED NEW SENSOR, TPMS LIGHT IS OFF",01-JAN-0001,E84,1, $87.19 , $91.98 , $45.99 ,X,This vehicle line not referenced on Ford AFW as applicable to this AF%.,,1.830136986,,,,,,,,,,,,,,,,,,
